Title,Singer,Song_ID,Release_Date,Like_Count,lyrics,Album,Genre
행복의 시작,닥터민 (Dr.min),36415287,2023.05.03,0,"사람들은 모두 다 행복하길 원해
하지만 행복이란 쉽게 얻질 못해
매일매일 하루종일 찾아서 헤매지만
보물찾기 게임처럼 어딨는지 몰라
알고보니 행복은 나에게 있었어
모든 상황 똑같은데 불행도 행복도 돼
내 마음만 바꾸면 행복하게 돼
지금 시간 이 자리가 행복의 시작이야
숨쉬는 것도 행복 말하는 것도 행복
밥먹는 것도 행복 잠자는 것도 행복
잘나갈때 조심하고 못나갈 때 기죽지마
위를 봐도 한이 없고
아래를 봐도 한이 없어
어깨에 힘을 빼고 부드럽게 생각해봐
행복이 슬금슬금 내 생각을 가득채워
알고보니 행복은 나에게 있었어
모든 상황 똑같은데 불행도 행복도 돼
내 마음만 바꾸면 행복하게 돼
지금 시간 이 자리가 행복의 시작이야
파란 새싹도 행복 찜통 더위도 행복
낙엽이 굴러도 행복 덜덜 떨어도 행복
항상 기뻐해
쉬지말고 기도해
범사에 감사해
행복을 찾으려면 그렇게 살아봐
행복을 얻으려면 그렇게 지내봐
항상 기뻐해
쉬지말고 기도해
범사에 감사해
행복을 찾으려면 그렇게 살아봐
행복을 얻으려면 그렇게 지내봐
항상 기뻐해
쉬지말고 기도해
범사에 감사해
행복을 찾으려면 그렇게 살아봐
행복을 얻으려면 그렇게 지내봐",행복의 시작,댄스
매력남 매력녀,이백길,36415242,2023.05.03,1,"보면 볼 수록 매력이 더욱 넘치는
남자가 여기에 있다
만나보면 자꾸만 빠져드는
남자가 여기에 있다
매력남 매력남 그게 바로 니 앞에 있다
매력남 매력남 그게 바로 내 선물이야
보면 볼 수록 매력이 더욱 넘치는
여자가 여기에 있다
만나보면 자꾸만 빠져드는
여자가 여기에 있다
매력녀 매력녀 그게 바로 내 앞에 있다
매력녀 매력녀 그게 바로 니 선물이야
얼굴도 몸매도 성격도 다 좋다지만
제일 중요한 매력이
바로 여기에 가득 차 있다
얼굴도 몸매도 성격도 다 좋다지만
제일 중요한 매력이
바로 여기에 가득 차 있다
매력녀 매력녀 그게 바로 내 앞에 있다
매력녀 매력녀 그게 바로 니 선물이야
매력녀 매력녀 그게 바로 내 앞에 있다
매력녀 매력녀 그게 바로 니 선물이야
여기에 가득 차 있다
여기에 가득 차 있다",매력남 매력녀,댄스
BLOOM,레니 (Leni),36415092,2023.05.03,23,"날 어지럽게 만드는 고민들
모두 떨쳐내 yeah yeah yeah (ay)
아무 생각 없이 난 그저 살아가고 있어
yeah yeah yeah yeah
빨리 떠나보자 어디든 즐기면서 계속
다 이뤄질거야
like R=VD (알은 브이디) yeah
이 설렘이 영원할 거라고 난 믿어
이 기분을 기억해
시원한 바람 맞으며
drivin drivin drivin (기억해 이 순간)
펼쳐질 미랜 will be so bright
I'm about to bloom
기분은 high 같이 떠나자 move
준비할 필요는 없어
just go ooh wah ah yeah
어디든 go ooh wah ah yeah
I'm about to bloom
시동을 걸고 자 떠나자 Vroom
준비할 필요는 없어
just go ooh wah ah yeah
어디든 go ooh wah ah yeah
망설이기 보단 그냥 go
걱정은 전부 놓고 여유롭게 feel this vibe
아무 계획 없이 그냥
온종일 play I'm on my way
하늘 높이 (Fly~)
빨리 떠나보자 어디든 즐기면서 계속
다 이뤄질거야 like R=VD yeah
이 설렘이 영원할 거라고 난 믿어
이 기분을 기억해
시원한 바람 맞으며
drivin drivin drivin (기억해 이 순간)
펼쳐질 미랜 will be so bright
I'm about to bloom
기분은 high 같이 떠나자 move
준비할 필요는 없어
just go ooh wah ah yeah
어디든 go ooh wah ah yeah
I'm about to bloom
시동을 걸고 자 떠나자 Vroom
준비할 필요는 없어
just go ooh wah ah yeah
어디든 go ooh wah ah yeah
빛이 나 언제나 난 everyday
화려한 꽃이 피듯이 shinin bright
정답은 없어
내가 만들어 가 oh ooh wah
I'm about to bloom
기분은 high 같이 떠나자 move
준비할 필요는 없어
just go ooh wah ah yeah
어디든 go ooh wah ah yeah
I'm about to bloom
시동을 걸고 자 떠나자 Vroom
준비할 필요는 없어
just go ooh wah ah yeah
어디든 go ooh wah ah yeah",BLOOM,댄스
나의 바람 (Wind And Wish),비투비,36414423,2023.05.02,58793,"Woo Ah Woah 내 맘을 전해줘
저 멀리 그대에게 닿도록
Woo Ah Woah 내 바람이 스칠 때
행복을 느낄 수 있게
긴 하루의 끝에 또 너를 생각해
오늘 넌 어떻게 하루를 보냈을까
시간은 빠르게 도는데
여전히 내 맘은 똑같아
넌 별일 없기를 오늘도 바라
행복하고 잘 지내길 바라
진심이야 I’m not lying
맘을 담아 너를 응원해
To your future endeavors yeah
우리 Happily ever after
바람과 사라졌지만
I still wish you the best
Cuz I love whenever you smile
Woo Ah Woah 내 맘을 전해줘
저 멀리 그대에게 닿도록
Woo Ah Woah 내 바람이 스칠 때
행복을 느낄 수 있게
Everybody say WAW
Yayayaya
나의 바람 갈 수 있게 WAW
Yayayaya
날 느낄 수 있게
가끔은 허전해 어딘가 모르게
그래도 행복해 괜찮아 모든 게
아름답던 우리 추억이
꽤 힘이 되곤 해 Yeah
너도 그러길 오늘도 바라
네가 그리울 땐 눈을 감아
살랑살랑 두 뺨을 간지럽히는 바람
어느새 귀에 걸린 입꼬리
산뜻하게 흥얼거림 허밍 Errbody say
(Um-um-um-um) Say
(Um-um-um-um) For a better day
너의 숨결을 느낄 때
다시 나아갈 수가 있기에
넌 계속 행복해 줘
늘 그렇게 빛나줘
너의 바람 느껴질 때
그때 웃을 수 있게
Woo Ah Woah 내 맘을 전해줘
저 멀리 그대에게 닿도록
Woo Ah Woah 내 바람이 스칠 때
사랑을 느낄 수 있게
Everybody say WAW
Yayayaya
나의 바람 갈 수 있게 WAW
Yayayaya
날 느낄 수 있게
Say WAW",WIND AND WISH,댄스
Paradise (Feat. Prin),정주연,36411194,2023.05.02,3,"지나쳐가는 많은 사람들 속에
내겐 빛이 나는 그런 사람이 있어
함께 있을 날을 나는 기다려왔어
둘만의 달콤한 시간을 만들어
You & I
이젠 우리가 눈 맞추지 않아도
네 맘 깊은 슬픔
너 나에겐 말해도 돼 yeah
사랑하는 마음을 보여주고 싶어
Who's in love with you? 얘기 해줄래?
You're Paradise You're Paradise
너는 Paradise 함께 라면 좋아
나만의 Paradise
더 이상의 숨김 이제는 내게 없어
내 손을 잡아주던 그 날부터였을까?
함께 있는 날이 매일 여행같아
둘만의 달콤한 시간을 만들어
You & I
이젠 우리가 눈 맞추지 않아도
네 맘 깊은 슬픔
너 나에겐 말해도 돼 yeah
사랑하는 마음을 보여주고 싶어
Who's in love with you? 얘기 해줄래?
Para para dise ~ 지금 다가와 줘
Para para dise ~ 우우우~
Para para dise ~ 지금 얘기해 줘
Para para dise ~
You & I
이젠 우리가 눈 맞추지 않아도
네 맘 깊은 슬픔
너 나에겐 말해도 돼 yeah
사랑하는 마음을 보여주고 싶어
Who's in love with you? 얘기 해줄래?
You're Paradise You're Paradise
너는 Paradise 함께라면 좋아
나만의 Paradise
Paradise",Paradise,댄스
Destiny,미코코로 (박지윤),36410102,2023.05.02,13,"아스라이 흩어진 작은 너의 기억에~
언젠가 꽃 피울 나의 향기,
니 맘에 울려 퍼지길~ 기.도.할.게 난!
쓸쓸하게 떨어지는 별빛에
조금씩 나의 맘도 흐릿해져가
아득히 멀~어진 너를 떠~올려
작은 불꽃을 피운다
어렴풋이 느껴지는 온기에
숨겨온 내 맘 꺼내어 본~다
파랗게 멍~든 가슴
눈물로 얼~룩진 나의 시간이
더 이상 차갑지 않게
꾹 참고 냉정해져도 (자꾸 헤집어놔~)
애써 지워도 (깊이 파고드는 너~)
더 이상 부정 할 수는 없는 걸
조용히 흐르던 나의 물결이
크게 소리치잖아
날 가둬 둔 안개 속
너를 찾아갈거야
조그마한 발걸음 딛어본다
거침없는 내 선택은
이 세상이 정해준
단 하나의 운명이니까
떨려오는 내 입술
네게 다가갈거야
너무 놀라진 않았으면 해
후회없는 내 선택은
끝내 희망으로 펼쳐질거야
천천히
처량하게 비춰오는 달빛에
조금씩 나의 맘도 서글퍼져가
쓸쓸히 다가온 시린 기억이
날카롭게 나를 찌른다
매말랐던 내 감정에 비친
촉촉하게 적셔지는 눈빛
내게 남겨진 니 온기
모두 완벽한 걸
파랗게 멍~든 가슴
눈물로 얼~룩진 나의 시간이
더 이상 차갑지 않게
따스히 내린 눈 처럼
포근히 감싸 안아준다면
나는 녹아내려 네게 스며든
이 순간
꾹 참고 냉정해져도 (자꾸 헤집어놔~)
애써 지워도 (깊이 파고드는 너~)
더 이상 부정 할 수는 없는 걸
조용히 흐르던 나의 물결이
크게 소리치잖아
날 가둬 둔 안개 속
너를 찾아갈거야
조그마한 발걸음 딛어본다
거침없는 내 선택은
이 세상이 정해준
단 하나의 운명이니까
떨려오는 내 입술
네게 다가갈거야
너무 놀라진 않았으면 해
후회없는 내 선택은
끝내 희망으로 펼쳐질거야
(눈부신 빛으로 채울거야)
거침없는 내 선택은
이내 찬란한 별 빛이 될거야
너와 내가 만들어 낼
이야기",그랑사가 캐릭터 테마 Part.3,"댄스, 게임"
UNFORGIVEN (feat. Nile Rodgers),LE SSERAFIM (르세라핌),36411342,2023.05.01,118437,"Unforgiven I’m a villain I’m a
Unforgiven 난 그 길을 걸어
Unforgiven I’m a villain I’m a
새 시대로 기억될 unforgiven
Yeah what you want?
불편함이 깃든 face, wanna shut me up
사냥감을 거듭해 찾는 워리어S
너의 game에 난 문제아
such a freak 골칫거리
Let me tell you ‘bout LE SSERAFIM
내가 제일 싫은 건 낡은 대물림
어둠 속 불을 켜 마치 rebellion
We gonna kick it break it
rules gon’ give up
Unforgiven yes I was bleeding
힘없이 늘 져야만 했던 싸움 but I ride
바란 적도 없어 용서 따위는
난 금기를 겨눠 watch me now
Now now now
Unforgiven I’m a villain I’m a
Unforgiven 난 그 길을 걸어
Unforgiven I’m a villain I’m a
새 시대로 기억될 unforgiven
나랑 저 너머 같이 가자
my “unforgiven girls”
나랑 선 넘어 같이 가자
my “unforgiven boys”
Unforgiven unforgiven unforgiven
한계 위로 남겨지는 우리 이름
나랑 저 너머 같이 가자
my “unforgiven girls”
U-unforgiven-given-given
내 style로 livin’ livin’ livin’
내 방식 아주 원 없이
또 한국말론 아주 “철없이”
Get started let’s get started
미래 그 앞에 새겨둬 나의 story
신념이 죄면 난 villain,
I'm not that cinderella type of a girl
Unforgiven yes I was bleeding
힘없이 늘 져야만 했던 싸움 but I ride
바란 적도 없어 용서 따위는
난 금기를 겨눠 watch me now
Now now now
Unforgiven I’m a villain I’m a
Unforgiven 난 그 길을 걸어
Unforgiven I’m a villain I’m a
새 시대로 기억될 unforgiven
나랑 저 너머 같이 가자
my “unforgiven girls”
나랑 선 넘어 같이 가자
my “unforgiven boys”
Unforgiven unforgiven unforgiven
한계 위로 남겨지는 우리 이름
나랑 저 너머 같이 가자
my “unforgiven girls”
Unforgiven I’m a villain I’m a
Unforgiven 난 그 길을 걸어
Unforgiven I’m a villain I’m a
Unforgiven 난 그 길을 걸어
Oh I will never be a clown
Oh 보게 될 거야 나다움
Oh 내 목소린 좀 loud
Oh I don’t care just shout it out!
나랑 저 너머 같이 가자
my “unforgiven girls”
나랑 선 넘어 같이 가자
my “unforgiven boys”
Unforgiven unforgiven unforgiven
한계 위로 남겨지는 우리 이름
나랑 저 너머 같이 가자
my “unforgiven girls”",UNFORGIVEN,댄스
사랑 그게 뭔데,장혜리,36411254,2023.05.01,132,"워우~ 워우~ 워우~ 워워~
(사랑 사랑 그게 뭔데)
워우~ 워우~ 워우~ 워워~
(왜 눈물이 나는 건데)
딱 한 잔의 추억으로만 남아서
별거 아닌 지난 일이 될 거야~
괜찮아~~
딱 오늘만 슬퍼하면 되는 거지
내일은 아마 괜찮을 거야
너 없이는 아무것도 못 하는데
이 힘든 이별 나 혼자 해야 해
이렇게~~~
사랑해서 떠난다는 말
그 말에 나는 웃어 줘야 하니~~
워우~ 워우~ 워우~ 워워~
(사랑 사랑 그게 뭔데)
워우~ 워우~ 워우~ 워워~
(왜 눈물이 나는 건데)
워우~ 워우~ 워우~ 워워~
(사랑 사랑 그게 뭔데)
워우~ 워우~ 워우~ 워워~
(왜 눈물이 나는 건데)
너 없이는 아무것도 못 하는데
이 힘든 이별 나 혼자 해야 해
이렇게~~~
사랑해서 떠난다는 말
그 말에 나는 웃어 줘야 하니~~
워우~ 워우~ 워우~ 워워~
(사랑 사랑 그게 뭔데)
워우~ 워우~ 워우~ 워워~
(왜 눈물이 나는 건데)
워우~ 워우~ 워우~ 워워~
(사랑 사랑 그게 뭔데)
워우~ 워우~ 워우~ 워워~
(왜 눈물이 나는 건데)",Love & Sorrow,댄스
돈 좀,Bummy (버미),36411608,2023.05.01,1,"돈 좀 뿌려봐
뿌려봐
돈 좀 뿌려봐
지갑 열어서 막
내게 돈 좀 던져봐
던져봐
한심하게 날
씹어도 괜찮아
그냥 돈 좀 던져봐
평생을
빈둥거리면서 코만 파고 싶어
어차피
평생 일만 해도 못산다며 내 집
게으름에 대한 핑계는 나라가 대주고
난 그저 놀며 먹고 싶어요
나의 잘못이
아니라는데
누가 그러냐고? 평론가가 그러시던데
Not my fault
순전 무결한
청년이니까 넌 그냥 내게 돈 좀 뿌려
I don't know 몰라 어떤 게 정답인 건지
I don't know 몰라 얼마가 적당한 건지
그냥 돈 좀 막 뿌려봐
돈 좀 돈 좀 돈 좀
돈 좀 돈 좀 돈 좀
뿌려봐
뿌려봐
내게 돈 좀 뿌려봐
내게 돈 좀 던져봐
던져봐
맨입으로 날
욕하는 건 안 돼
동전 같이 던져봐
평생을
정시 출근 없는 삶을 살고 싶어
어차피
난 저주받은 세대 속의 희생
게으름에 대한 핑계는 나라가 대줘요
난 그저 놀며 먹고 싶어요
Surf on press
나를 대변하는 Portal
살짝 지쳐 나는 Stress
호들갑을 떨어주는 People
목숨을 걸고 놀아
진실은 나도 몰라
진짜로 아픈 이는
관심 없어
쏟아지는 비명과
우뚝 서는 나의 Representative
떨어지는 눈물과
그걸 쓸어담아 Make it product
Uh Yeah
기가 막힌 상황 Tok that
너덜해진 맘에
그냥 돈 좀 던져
don't know 몰라 어떤 게 정답인 건지
I don't know 몰라 얼마가 적당한 건지
그냥 돈 좀 막 뿌려봐
돈 좀 돈 좀 돈 좀
돈 좀 돈 좀 돈 좀",돈 좀,댄스
January Night,Nightfalls,36411514,2023.05.01,0,,January Night,댄스
넌 날 못이겨 (YES I'M A QUEEN),퀸동주,36410584,2023.05.01,3573,"오 마이 갓 넌 도망칠 수 없어
날 본 순간
미친 존재감의 퀸의 혁신
아무도 못 막아
순진한척 다가오는 퍽보이 어딜쳐따보니
달콤한 라티카 투티라
라티카 투티라 이쁜거 첨보니
너 빼고 모두 다 알아 팔로팔로 미
편견없이 자유로워질래 라티카 투티라
라티카 투티라 드림컴트루 팔로팔로미
날 알기엔 시간이 없어
굳이 시간 낭비 하지마 너 같은 등신
난 관심없어 가던길 가
go away go away 너와는 달라
난달라 달라 달라 칵투
나는 널 원하지 않아
날 사랑하는 보이 컴온베베
원몰타임 다시 한번 말해줄래 난 널
원한다고 give me 원몰타임 고집 세워
불평하는 넌 저리가
이제는 제발 좀 닥쳐줄래
yes im a queen 넌 나를 못이겨
붐붐
내 스탈은
둠둠
내 몸매는
줌줌
날 바라봐
어어
내 몸매는
붐붐
내 스탈은
둠둠
날 바라봐
줌줌
날 느껴봐
어어어 얘
붐붐
오마갓
붐붐
줌줌
이리온
필요없어 퀸은 함께
공존해 킹과 난 퀸퀸퀸
넌 날 좋아하는 하입보이 킹킹킹
라티카 투티라 라티카 투티라
울리는 심장소리
모른척 하지마 넌 날 원하고 난 널 원해
좋아한다고 you love me 날 무시할땐
언제고 이제와서 친한척이야 꺼져
너 수준은 딱 거기까지야 그게 끝이야
저리 치워 꺼져 다신 날 보지마 크악 투
나를 보는 가십 던져봐
내 모습 그대로 바라봐
이대로 날 안아봐~
yes im a queen 유일한 퀸
붐붐
둠둠
줌줌
어어
follow follow
붐붐
둠둠
줌줌
어어어 얘
오마갓
이리온
에리얼~",넌 날 못이겨 (YES I'M A QUEEN),댄스
Twinkle Twinkle Twinkle,제이원,36410513,2023.05.01,2,"Twinkle Twinkle Twinkle 빛이 나요
그대 모습은요
이대로 더 멀리 떠나봐요
모두가 잠든 사이
바람이 살랑이는 5월의 거리에서
나 그대를 만났죠
그동안 찾아왔던 마지막 퍼즐 조각
그대란 걸 알았죠
스쳐 지나간 수많은 사람들 속에
나를 이끄는 빛이 있어
이제서야 나만의 소중한
에메랄드 그대를 찾은 거죠
Twinkle Twinkle Twinkle 빛이 나요
그대 모습은요
이대로 더 멀리 떠나봐요
모두가 잠든 사이
Woo hoo Woo hoo
헤어날 수 없는 걸요
Woo hoo Woo hoo
나를 더 사랑해 줘
꽃잎이 속삭이고 석양이 물들어도
나 변하지 않아요
그동안 찾아왔던 나만의 엘도라도
그대란 걸 알았죠
밤이 깊어도 타오르는 불꽃처럼
나를 이끄는 빛이 있어
이제서야 나만의 소중한
에메랄드 그대를 찾은 거죠
Twinkle Twinkle Twinkle 빛이 나요
그대 모습은요
이대로 더 멀리 떠나봐요
모두가 잠든 사이
Twinkle Twinkle Twinkle Twinkle
헤어날 수 없는 걸요
Twinkle Twinkle Twinkle Twinkle
나를 더 사랑해 줘
Twinkle Twinkle Twinkle 빛이 나요
그대 모습은요
이대로 더 멀리 떠나봐요
모두가 잠든 사이
Woo hoo Woo hoo
헤어날 수 없는 걸요
Woo hoo Woo hoo
나를 더 사랑해 줘",Twinkle Twinkle Twinkle,댄스
Save Us Tonight (K Ver.),박정민,36410497,2023.05.01,27,"Save us tonight, give us tonight
아침 해도 놀랄 만큼
Save us tonight, give us tonight
1.2 ready go
마치 꿀처럼, 달콤한 너
Save us tonight, give us tonight
오늘처럼만
Everyday 레몬 티처럼 달콤한 입술이
내 볼에 닿을 때 나도 몰래 shiny heart
아침햇살 보다 더 맑은
그대 미소는 저 파란하늘을 비추고
마법처럼 나타난 내 꿈 속 이상형
(꿈일까 생실까?)
어디라도 난 상관없는 걸
그대만이 꿈 속에도
함께 있고픈 단 한 사람
Save us tonight, give us tonight
아침 해도 놀랄 만큼
Save us tonight, give us tonight
1.2 ready go
마치 꿀처럼, 달콤한 너
Save us tonight, give us tonight
오늘처럼만
Save us tonight, give us tonight
사랑한단 표현은
Save us tonight, give us tonight
미소로 대신하죠
Save us tonight, give us tonight
풀리지 않는 마법의 주문
Save us tonight, give us tonight
너 uh~woo
Everyday 레몬 티처럼 달콤한 미소로
날 바라볼 때면 나도 몰래 shiny smile
저 하늘 달빛 보다 밝은
그대 미소는 이 어두운 거리를 비추고
저 별처럼 빛나는 그대 두 눈동자
(살며시 다가가) 가득히
나를 담아 줄께요
그대만이 꿈 속에도
함께 있고픈 단 한 사람
Save us tonight, give us tonight
아침 해도 놀랄 만큼
Save us tonight, give us tonight
1.2 ready go
마치 꿀처럼, 달콤한 너
Save us tonight, give us tonight
오늘처럼만
12시가 지나가도 그댄 곁에 있어요
유리구두를 벗고
동화처럼 사라지지 말아 줘
Save us tonight, give us tonight
아침 해도 놀랄 만큼
Save us tonight, give us tonight
1.2 ready go
Save us tonight, give us tonight
아침 해도 놀랄 만큼
Save us tonight, give us tonight
1.2 ready go
마치 꿀처럼, 달콤한 너
Save us tonight, give us tonight
오늘처럼만
Save us tonight, give us tonight
사랑한단 표현은
Save us tonight, give us tonight
미소로 대신하죠
Save us tonight, give us tonight
풀리지 않는 마법의 주문
Save us tonight, give us tonight
너 uh~woo",Save Us Tonight 한국어반,댄스
BOOM,B:lank (블랭크),36411714,2023.04.30,4,"어둠은 더 빛나게 해,
I keep getting stronger.
I can't stop it 겁먹지 마
도망칠수록 더 조여오는 our pain
I'm crying out I'm holding high
두 손을 모아
멈추지 않아 my prayer
너무 갇혀있진 마
널 찾지 않아 you realize mind
내게 너를 줘 mine
서서히 잠식되는 가면에
raising a devil I’m going to show up
You know what i'm boom boom boom
You want to take it out
You want to take it out
You don't care what anymore
You know what I'm boom boom boom
따라 할 수 있음 해봐 언제든지
do do what your gonna do
부셔줄 게 두 두두
정신 못 차리는 놈들한테
격식 따윈 필요 없어 이게 내가 사는 방식
잃어버린 숨결
get back Queen이라는 타이틀을 got it
무덤 속에 흩어진 나의
blood Do you hear that? look at me
멈추지 않아 my prayer
너무 갇혀있진 마 널 찾지 않아
You realize mind 내게 너를 줘 mine
서서히 잠식되는 가면에
raising a devil I’m going to show up
You know what i'm boom boom boom
You want to take it out
You want to take it out
You don't care what anymore
You want to take it out
You want to take it out
You don't care what anymore
You don't care what anymore
멈추지 않아 louder 어떤 유혹과 핍박도
난 진 적이 없어 It's my plan 나의 Move
I'm never lost 강해져 더 너도 느껴 봐
이 안에 끓는 Black Blood
You want to take it out
You want to take it out
You don't care what anymore
You want to take it out
You want to take it out
You don't care what anymore",BOOM,댄스
펭수로 하겠습니다 (Dance Remix),펭수,36410541,2023.04.29,1273,"Yeah
Feel good
펭수 Come Back
G.I.A.N.T
P.E.N.G.S.O.O
Don't I know you from somewhere?
That's right. My name is 펭수
박수 크게 한 번 치고 Build up
자신 있게 마치 보디빌더
쉽진 않겠지만 Let it go 직진
빌보드를 향해 계속 행진
G.I.A.N.T
P.E.N.G.S.O.O (펭하)
G.I.A.N.T
P.E.N.G.S.O.O
Just slide slide slide just slide
Let's glide glide glide just glide
So won’t you wiggle for me
Go ahead we young wild and free
Up down there you go
Let me see you touch your toes
So won’t you wiggle for me
Go ahead we young wild and free
Up down there you go
Let me see you touch your toes
바닷속을 날아
빌보드로 가자
느낌이 달라
기분이 좋아 (좋아)
작은 날개로
하늘 위를 헤엄
내가 제일 최고
1위 할 거예요
(JK on the track)
나눌수록 곱해지는 신비한 펭수
사랑하는 맘 나눠 베푸는 땡큐
펭귄의 날 It's earth thang
생축 It's birthday
꼴등은 없다 모두 도전하면 돼 (웩)
웃음 부신 눈빛 손이 올라가면 웩 (웩)
행진 행진 캡틴 펭귄
자신감 넘치는 남극의 레전드
G.I.A.N.T
P.E.N.G.S.O.O (펭하)
G.I.A.N.T
P.E.N.G.S.O.O
Just slide slide slide just slide
Let's glide glide glide just glide
So won’t you wiggle for me
Go ahead we young wild and free
Up down there you go
Let me see you touch your toes
So won’t you wiggle for me
Go ahead we young wild and free
Up down there you go
Let me see you touch your toes
바닷속을 날아
빌보드로 가자
느낌이 달라
기분이 좋아 (좋아)
작은 날개로
하늘 위를 헤엄
내가 제일 최고
1위 할 거예요",챌린지 프로젝트,댄스
별그램(Stargram),아이클링(ikling),36404499,2023.04.28,33,"Paradise 너와 함께있는
이 공간이 피드 속의 감성
두번 클릭만으로 감정을 모두
드러내진 말아야지
수많은 하트중에 한 개
여러 이름들 중 띄지않지
그냥 보고없어지는
스토리 무심히 넘어가
ding ding하고 울리면
bing bing 돌려 말을하네
니가 보고싶다고
니 생각한다고
같은 사진 속 다른 한가지
너는 모르는 단 한가지의 비밀
Follow 하는 많은 사람들 중에
Oh oh 가장 친한 사람
totatikita
시간만 흐르고
totatikita
변한건 없잖아
Wishlist 상상하며 담아둔
내 작은 공간 with you
맛집, 테스트, 좋은 데이트 장소까지
알아보고 있는 걸
One minute Ten minute
미묘하잖아 우리
Monday Saturday
아 일요일은 쉬고
Ding dong 하고 울리면
ping pong 주고 받아야지
너무 티 나지 않게
조금 아닌척하며
같은 사진 속 다른 한가지
너는 모르는 단 한가지의 비밀
follow 하는 많은 사람들 중에
Oh oh 가장 친한 사람
몰래 보고 또 설레고 뒤에서만
바라보고 있잖아 아닌 척 하잖아
그런 내게 다가오는 너
그것만으로도
같은 사진 속 다른 한가지
너는 모르는 단 한가지의 비밀
follow 하는 많은 사람들 중에
Oh oh 가장 친한 사람
totatikita
시간만 흐르고
totatikita
없잖아",Totatikita,댄스
I Love Selena Gomez (Feat. VOCALOID Tone Rion),JEL,110576900,2023.04.28,0,,computer girls,댄스
