Title,Singer,Song_ID,Release_Date,Like_Count,lyrics,Album,Genre
헤엄 (Feat. 휘아),토링,36562423,2023.06.26,8,"넌 내게 말했어 I want you to come
신기한 세계를 보여줄게
내가 네게 해줄 수 있는 말 this
I told you, ‘We’re in different world’
The way you talk
The way you look
The way you pull my eyes to the box
The way you dream
모두 다 알고 싶어
너도 꿈을 꾸니
우린 서로 눈을 마주친 채
우린 서로 다른 호흡을 해
Can we feel, Can we love
유리벽을 넘어 널 안고 싶어
네가 있는 세계에 몸을 담고
같은 속도로 헤엄을 쳐
네가 느끼는 세상이 보여
How could I say I know you
Here we fly to the world for love
I wanna hear what you want for love
I wanna dream to the world for love
This is the world we share for love
이곳에 규칙은 Don’t forget, my dear
서로의 세계를 넘지 않기
내가 네게 원하는 한 가지 this
I want you to be happy there
The way you talk
The way you look
The way you pull my eyes to the box
The way you dream
모두 다 알고 싶어
너도 꿈을 꾸니
네가 오기 전엔 dry and boring
나는 혼자 gray but longing
너의 존재만으로 꽉 차버린 이곳의 공기
다른 세계의 너와 나
우리 둘만의 꿈을 꿔 봐
거기 내가 있을 거야
네가 있는 세계에 몸을 담고
같은 속도로 헤엄을 쳐
네가 느끼는 세상이 보여
How could I say I know you
너와 같은 하늘 아래에서
반짝이는 달을 타고 날래
Can you come to my dream
유리 벽이 없는 곳
자 kiss 해 줘
네가 있는 세계에 몸을 담고
같은 속도로 헤엄을 쳐
네가 느끼는 세상이 보여
How could I say I know you
Here we fly to the world for love
I wanna hear what you want for love
I wanna dream to the world for love
This is the world we share for love",Goldfish,댄스
Confess To You,림킴 (김예림),36562216,2023.06.25,6908,"어느 날 내 곁에 다가와 웃는 너
조금씩 내 맘도 너에게 빠져 들어가
별처럼 밝게 빛나는
어둔 밤 밝게 비추는
너의 모습이 눈 부셔
따스한 봄처럼 웃는
늘 환하게 웃고 있는
널 맘에 가득 안고 싶어
I Confess to you, my lovely lover,
You're the one I've been dreaming of.
I confess to you, my heart finds solace,
You're the one I've been dreaming of.
한걸음 조금씩 다가가 너에게
별처럼 밝게 빛나는
어둔 밤 밝게 비추는
너의 모습이 눈 부셔
긴 어둠 속 밝게 비춘
포근한 달빛과 같은
널 맘에 가득 안고 싶어
I Confess to you, my lovely lover,
You're the one I've been dreaming of.
I confess to you, my heart finds solace,
You're the one I've been dreaming of.
Your love is a sweet dream
Your love is a sweet dream
Your smile brightens up my world,
This love is so true, sent from above.
I Confess to you, my lovely lover,
You're the one I've been dreaming of.
I confess to you, my heart finds solace,
You're the one I've been dreaming of.
Your love is a sweet dream
Your love is a sweet dream
Your love is a sweet dream
I confess my love, please stay with me",킹더랜드 OST Part.2,"댄스, 국내드라마"
엔딩요정,Juju B. Goode,36558578,2023.06.25,9,"지그시 나를 바라보다
손끝을 타고 들어와
은하수 아래 춤추는 요정
살며시 내게 속삭이며
마지막처럼 안아주네
두눈을 감고 널 그린거야
I dream of you
무대가 끝나도
내 맘엔 오직 엔딩요정뿐
Pull down, refresh
숨이 차올라도
도저히 내맘을 달랠순없어
허나 너의 얼굴을 도저히
기억할 수 없네 참 아이러니해
save for later now
기다리기 싫어요
I dream of you
무대가 끝나도
내 맘엔 오직 엔딩요정뿐
눈이 부셔도
끝이 안 보여도
도저히 내맘을 달랠수없어
Tell me Tell me
너의 모든 걸 내게 말해줄래
Show me Show me
너의 모든 걸 내게 보여주오
Cus everytime you show up on my feed
Oh baby you know ill be losing sleep
Can’t take my eyes off you
The one i’ll be with at the end",엔딩요정,댄스
Bergamo,Forest Music,36556312,2023.06.24,0,,Bergamo,댄스
Mountain God,Remind Voice,36556310,2023.06.24,0,,Mountain God,댄스
Oh No There I Go,Andrea Maria Ricchetti,110622363,2023.06.23,0,,Oh No There I Go,댄스
날 따라와요 (Feat. 김윤재),Musist,36560305,2023.06.23,1,"높은 곳에 올라가서 크게 소리쳐
I’m not afraid 나를 믿어 기죽지 말자구
더 거친 숨을 몰아쉬어도 돼
달려온 만큼 가까워졌어 oh
한걸음만 더 걸어나가자 자!
나 앞에 있잖아
자욱한 안개 날 덮쳐오지만
내 굳센 발걸음 멈추지 않으리
날 따라와요 날 따라와요 날 바라봐요
생각하지 마요 그대로 따라와 그대로 oh
미뤄뒀던 일을 시작해 now
두려웠던 마음 마주해 now
약해빠진 생각하지 말고
나를 따라와
높은 곳에 올라서서 멀리 소리쳐
I can deal with it 해결해버려
문제는 없다구
더 거친 숨을 몰아쉬어도 돼
달려온 만큼 가까워졌어 oh
한걸음만 더 걸어나가자 자!
나 옆에 있잖아
자욱한 안개 날 덮쳐오지만
내 굳센 발걸음 멈추지 않으리
날 따라와요 날 따라와요 날 바라봐요
생각하지 마요 그대로 따라와 그대로 oh
다시 시작해 어떤 것이든
두려워 말고 시작해 나를 따라
날 따라와요 날 따라와요 날 바라봐요
생각하지 마요 그대로 따라와 그대로
미뤄뒀던 일을 시작해 now
두려웠던 마음 마주해 now
약해 빠진 생각하지 말고
나를 따라와",날 따라와요,댄스
FLY,미금 (MIGEUM),36560258,2023.06.23,12,"I'm gonna fly fly fly
I'm gonna fly fly fly
매일 똑같은 나의 하루에
지루하던 내 일상에 유일하게 쉼터가 돼
내 작은 기억 속 어렴풋이 건넨 미소
like the rainbow after rain
you're my present don't forget
I'm gonna fly
난 시간을 거슬러
우리 모습을 그려
you know that I loved you
I need you baby
I'm gonna fly
내게로 와 공간을 채워
only you can fill me
baby don't leave me always by my side
네가 없는 내 시간 더디게만 가는데
넘 지루하기만 해 oh
멍하니 널 생각하다 가끔 길을 잃을 때
날 데려가 줬으면 해 baby
I'm gonna fly
난 시간을 거슬러
우리 모습을 그려
you know that I loved you
I need you baby
I'm gonna fly
내게로 와 공간을 채워
only you can fill me
baby don't leave me always by my side
네가 없인 견디기 힘든걸
내 삶에 넌 스며들었는걸
baby you're my everything holdin' me
네가 필요해 영원히 내 곁에 있어줘 yeah
I'm gonna fly
난 시간을 거슬러
우리 모습을 그려
you know that I loved you
I need you baby
(always by my side)
내게로 와 공간을 채워
only you can fill me
baby don't leave me always by my side
I'm gonna fly
난 시간을 거슬러
우리 모습을 그려
you know that I loved you
I need you baby
I'm gonna fly
내게로 와 공간을 채워
only you can fill me
baby don't leave me always by my side",FLY,"댄스, 인디음악"
Hero (Feat. PIL XAE),Keny,36560249,2023.06.23,15,"사실 난 겁쟁이, 거짓말쟁이
겁이 나서 아닌 척했잖아
지켜야 할 게 많아 이겨낸 척을 했지
겁이 났어 다 잃어버릴까 봐
하지 못해 오늘따라
마음을 울리는 낭만적인 말
마음이 욱해 오늘따라
기분 꽝이야 나도 몰래 나쁜 말
우리 엄마는 이런 내가
버팀목이라는데 어째 난 부실 공사
아무것도 하기 싫지만
그놈의 책임감에 다시 일어나
마음이 꺾일 것 같을 때는 들어 노래를
싸움이 한창인 내 삶은 애처롭게 우네
가슴이 무거워도 내려놓진 못해
빨간 망토를 두른 채 집을 지켰던 어린애
사실 난 겁쟁이, 거짓말쟁이
겁이 나서 아닌 척했잖아
지켜야 할 게 많아 이겨낸 척을 했지
겁이 났어 잃어버리게 될까 봐
수퍼파워도 용감한 마음도
없어 난 사실 겁이 많아
웃고있어도 망가져 버린 감정
언젠간 이겨내야 했던 거야
cuz I'm hero
cuz I'm hero
cuz I'm hero
cuz I'm hero
맨날 말로만 trip
난 필요해 너의 lip
애써 아닌 척은 lier
don’t stay tired
hero가 없으면 i just stay or die
우리 생각을 버리자고 오늘만
내게 필요했던 mercy
but you didn’t catch me
날 버리고 무시하던
그때의 날은 stay on my mind
잊으려고 하지마
그게 날 움직이게 만드니까
꿈 그건 나의 무지였다고
매일마다 속으로 다짐하고
아니야 그건 절대 아니야
우리 무엇보다 중요한 건
미래였잖아
근데 다시 또 세월이 지나면
나는 아프고 다시 슬프고
i’m gone
사실 난 겁쟁이, 거짓말쟁이
겁이 나서 아닌 척했잖아
지켜야 할 게 많아 이겨낸 척을 했지
겁이 났어 잃어버리게 될까 봐
수퍼파워도 용감한 마음도
없어 난 사실 겁이 많아
웃고있어도 망가져 버린 감정
언젠간 이겨내야 했던 거야
cuz I'm hero
cuz I'm hero
cuz I'm hero
cuz I'm hero
사실 난 겁쟁이, 거짓말쟁이
겁이 나서 아닌 척했잖아
지켜야 할 게 많아 이겨낸 척을 했지
겁이 났어 다 잃어버릴까 봐",Hero,"댄스, 인디음악"
Blowing My Mind,Daol (다올),36560218,2023.06.23,4,"하루종일 니 사진을 보며
온종일 너를 생각했어
어디를 가도 니 얼굴이 보여
내가 미쳤나봐 너만 보여
지금 무엇을 하나, 전화를 걸까
그냥 보러 무작정 가볼까
내 머릿속엔 오직 한사람
너의 얼굴만 떠올라
Blowing My Mind 그대를 향해
Sing for joy 그대만 생각하면
웃음이 나 바보같이
I'm Lovig you 널 좋아하나봐
웃는 얼굴이 예쁜 너
내맘을 설레게 해
아무거나 옷을 입어도
너무나 잘 어울려 Boy
하늘에서 내려온 천사인걸까
그냥 있어도 빛이 나
Shy boy
Blowing My Mind 그대를 향해
Sing for joy 그대만 생각하면
웃음이 나 바보같이
I'm Lovig you 널 좋아하나봐
마주치게 되면 환하게 웃고
괜히 그 옆자리에 앉아보고
그냥 너의 곁에 있고 싶어
너를 향해 달려 가볼게
Blowing My Mind 그대를 향해
Sing for joy 그대만 생각하면
웃음이 나 바보같이
I'm Lovig you 널 좋아하나봐
그저 니 곁에 갈수만 있다면
난 무엇이든 하고 말거야
그러니까 날 기다려줘
지금 너에게 갈게 Stay With me",Blowing My Mind,"댄스, 인디음악"
고독한 작곡가 (Feat. 다혜),오동석,36558607,2023.06.23,3,"이렇게 곡 쓴 지 오래
어느 덧 지겨운 하루
내가 만들었던 노래의
주인공 바로 너야
매번 피아노를 계속
손가락으로 치며 노래를 만들었지만
사실 이 노래 가삿말은
니 얘기를 하고 싶었어
슬피우는 이별노래처럼
너는 날 떠나기 시작했고
니가 듣게 된다면
다시 볼 수 있을까
노래를 듣질 않아 아무도 듣질 않아
내 노랠 듣질 않아 아무도 듣질 않아
그런 너에게 내가 만든 이 노래
간절히 들어 줄 너의 그 모습을
난 상상했어
방긋 웃고 있던 너의 얼굴
떠올리며 곡을 쓰던 나의 마음
그렇게 나는 곡을 썻어
한마디 말도 없이 떠나갔던
널 생각하며
슬피우는 이별 노래처럼
나는 널 지우기 시작했고
니가 행복했으면
정말 좋았을 텐데
어느 새 오늘이 일년 째
매일 밤 난 매일 밤 난
매일 밤 난
그런 너에게 내가 만든 이 노래
간절히 들어 줄 너의 그 모습을
난 상상했어
매일 통기타를 계속
손가락으로 치며
노래를 불러봤지만
사실 이 노래 가삿말은
내 얘기를 하고 있었어",고독한 작곡가,댄스
Diving,Arvia Area,36556289,2023.06.23,0,,Diving,댄스
Storm,코요태,36558295,2023.06.22,3387,"If you can be 비가 되어 내려
나의 머리 위에 앉아주렴
내 마음속에 깊은 곳까지
너 올 수가 없다면
If you can be 바람 되어 불어
나의 몸을 감싸 안아주렴
그렇게라도 영원히 내게 있어 줘
Darkness Storm
굳어진 우린 Stone Stone
Love is Gone
Don’t go away please stop stop
Darkness Storm
굳어진 우린 Stone Stone
Love is Gone
Don’t go away please stop stop
난 기다렸어 이 시간 모두
다 바친 거야 내 젊음 바쳐
널 사랑한 죄 그 한 이유로
날 버려왔던 거야
또 어디에서 넌 사랑하며
날 잊은 채로 또 웃겠지만
널 기다리는 내 모습만은 늘 행복해
만일 내게 올 수 없다면
그대로 사라져 주렴
나 없이 너 행복한 것은 원치 않아
If you can be 비가 되어 내려
나의 머리 위에 앉아주렴
내 마음속에 깊은 곳까지
너 올 수가 없다면
If you can be 바람 되어 불어
나의 몸을 감싸 안아주렴
그렇게라도 영원히 내게 있어 줘
Darkness Storm
굳어진 우린 Stone Stone
Love is Gone
Don’t go away please stop stop
Darkness Storm
굳어진 우린 Stone Stone
Love is Gone
Don’t go away please stop stop
가질 수 없다면 차라리 사라져 버려
나 아닌 다른 누구도 널 사랑할 수 없어
돌아가 날 사랑했던 그때로
돌아와 날 사랑했던 그대로
난 이대로 너와 헤어질 수 없어
Break it done like storm
난 하늘을 봐 저 구름 아래
너 어디선가 이 하늘 보며
날 생각할지도 모르잖아
그럴 거야
만일 내게 올 수 없다면
그대로 사라져 주렴
나 없이 너 행복한 것은 원치 않아
If you can be 비가 되어 내려
나의 머리 위에 앉아주렴
내 마음속에 깊은 곳까지
너 올 수가 없다면
If you can be 바람 되어 불어
나의 몸을 감싸 안아주렴
그렇게라도 영원히 내게 있어줘
If you can be 비가 되어 내려
나의 머리 위에 앉아주렴
내 마음속에 깊은 곳까지
너 올 수가 없다면
If you can be 바람 되어 불어
나의 몸을 감싸 안아주렴
그렇게라도 영원히 내게 있어줘
Darkness Storm
굳어진 우린 Stone Stone
Love is Gone
Don’t go away please stop stop
Darkness Storm
굳어진 우린 Stone Stone
Love is Gone
Don’t go away please stop stop",STORM,댄스
LOCKDOWN,이세계아이돌,36549241,2023.06.22,46193,"oh you can't stop me
못 멈춰 감히
손끝 하나도 건드리지 못하는 경지
점점 더 멀리 날아가 역시
따라잡을 수가 없어
we are one and only girls
이 어둠 속에 갇혀도
이 시간을 버리고
도망가 보려고 해도
이 길이 막혀도
날 막을 수 없을 거야 넌
oh drop it
get up and lockdown
Stop, you gotta lockdown
burn it up now we keep that movin'
Try, you gotta pipe down
turn it up now we still that groovy
Lockdown you better watch out
burn it up now we keep that moving
Try, you gotta pipe down
all my enemies are lockdown
행동을 제어 잘 보고 배워
누가 날 뛰어넘을 거란 착각
습관이 되어 밧줄에 매여
더 이상은 가만있지 않을 거야
we gotta lockdown yeah
훌륭한 판단 yeah
나의 길을 간 다음
예측을 전부 다 깨뜨려버려 breakdown
pedal to the metal
no matter what you say
쓸어버려 단 1,2 step
날 가두려 해도
you never stop me
널 위해 주는 피날레
so give me that give me that
내 운명이 그곳으로 이끌 때
light it up burn it all
this story is never end
이 어둠 속에 갇혀도
이 시간을 버리고
도망가 보려고 해도
이 길이 막혀도
날 막을 수 없을 거야 넌
oh drop it
get up and lockdown
Stop, you gotta lockdown
burn it up now we keep that movin'
Try, you gotta pipe down
turn it up now we still that groovy
Lockdown you better watch out
burn it up now we keep that moving
Try, you gotta pipe down
all my enemies are lockdown
you can't deny it
못 믿겠지만 더 이상 날 가둘 수는 없어
you can see my power 놓지 마
눈앞에 거대한 파도가 덮쳐
errbody hands up in the air
내가 잡아야 할 전부
의심 없이 손에 넣고 모두 걷어줘
뭐라 하던 i deserve it
전부 get it all
we are girls
like whole RU-BI-DUM-DUM
I got you shot you
like DUM-DA-BI-DA-BI-DUM-DUM
we are girls
like whole RU-BI-DUM-DUM
I got you shot you like
oh drop it get up and lockdown
Stop, you gotta lockdown
burn it up now we keep that movin'
Try, you gotta pipe down
turn it up now we still that groovy
Lockdown you better watch out
burn it up now we keep that moving
Lockdown you better watch out
all my enemies are lockdown",LOCKDOWN,댄스
Curiosity,Remind Voice,36556246,2023.06.22,0,,Curiosity,댄스
다시 태어나,나비 (Navi),36549607,2023.06.21,1131,"니가 나를 떠난 후로 매일 눈물 흘리며
술에 취해 잠들던 수많은 그 밤들
마주하고 싶지 않았던 거울 속 못난 내 모습
이젠 내가 다가가 날 안을게
다시 태어나 새롭게 시작할래
못난 내가 아냐
아무도 모르게 니가 날 몰라보게
180도 달라질 거야
갈수록 매일 예뻐지는 나 훨훨 날아올라
니 마음 애타게 날 보면 안달 나게
나를 사랑하게 될 거야
기대해
눈물 대신 땀을 흘리고 잃어버렸던 나를 찾아
눈부시게 걸어 세상 앞에 나갈래
마주치는 사람들 내게 끝없이 말을 건네고
가장 멋진 모습으로 웃을게
다시 태어나 새롭게 시작할래
못난 내가 아냐
아무도 모르게 니가 날 몰라보게
180도 달라질 거야
갈수록 매일 예뻐지는 나 훨훨 날아올라
니 마음 애타게 날 보면 안달 나게
나를 사랑하게 될 거야
기대해
너를 참 많이 원망했었어
내 모습이 참 많이 미웠어
니가 내게 했던 모진 말들이
불씨가 되어 내 모든 걸 바꾼 거야
다시 태어나 새롭게 시작할래
못난 내가 아냐
아무도 모르게 니가 날 몰라보게
180도 달라질 거야
갈수록 매일 예뻐지는 나 훨훨 날아올라
니 마음 애타게 날 보면 안달 나게
나를 사랑하게 될 거야
기대해",락락파티 Part.1,댄스
Who's Next,Lapillus(라필루스),36550866,2023.06.21,390,"Tell me who's next
Tell me who's next
Game is over 익숙해
이미 등장만으로 다 K.O.
타고난 걸 어떡해
재수 없어 보이지만
I was born to be a winner
I gotta run and run
I gotta do it now
I gotta I gotta
I gotta go up higher
내 Fit은 너의 Feed에
Yes I'm original
그 누구도 못 해 나의 Rival
뭐라 해도 I don't care Oh Oh Oh
Eh oh Eh oh
내 자체로 완벽해 Oh Oh Oh
Eh oh Eh oh
그래 어느 쪽에 설래
자 이제 선택해
What you gonna do
What you wanna do
That's me
다 따라불러 이 노래
Tell me who's next
Tell me who's next
Tell me who's next
Show what you got
What you got
What you got
Tell me who's next
Welcome L's nation
Here and now
Time to celebration
Tell me who's next
Tell me who's next
Tell me who's next
질러봐 Say my name
So tell me who's next
Fresh than other girls did!
Tell me who's next
Uh 말해봐 Who is the next?
머리 위 높게 친 Fence
넘어 승리할 자 guess who
(Yes we gonna first)
It's like a boom boom
내 심장 빠르게 Running
뒤는 보지 않아
걔넨 뻔하잖아
That's why
확실히 보여줄게 네 기대의 배로
피 가득 채워버려 새 눈 뜨게 해줄 Venom
새롭게 그려나가 Make a new fantasy
못 믿겠으면 말어 사실 We always do better
뭐라 해도 I don't care Oh Oh Oh
Eh oh Eh oh
내 자체로 완벽해 Oh Oh Oh
Eh oh Eh oh
그래 어느 쪽에 설래
자 이제 선택해
What you gonna do
What you wanna do
That's me
다 따라불러 이 노래
Tell me who's next
Tell me who's next
Tell me who's next
Show what you got
What you got
What you got
What you gonna do?
Nanana Nanana Nana nana
Nanana Nanana Nana
Nanana Nanana Nana nana
Nanana Nanana Nana Nananana
Tell me who's next
Nanana Nanana Nana nana
Tell me who's next
Nanana Nanana
Tell me who's next
Nanana Nanana Nana nana
Show what you got
What you got
What you got
Tell me who's next
Welcome L's nation
Here and now
Time to celebration
Tell me who's next
Tell me who's next
Tell me who's next
질러봐 Say my name
So tell me who's next",GIRL's ROUND Part. 2,댄스
Zero (J.I.D Remix),NewJeans,36549535,2023.06.21,7955,"정말 짜릿했어 어디선가
내게 윙크한 까만 눈동자
Boy, your beautiful eyes
got me lost now, yeah
깜짝 놀라게 하기는 해도
자신만만한 너의 그 태도
Liked you from the get go
Cool함은 그대로
부담감은 ‘제로’
Cuz you know you’re sparkling
like a shooting star
I can see us going far
얼마나 상큼할까
We will pop up all around the world
마법 같은 걸
I’m ready, let’s go
You already know
That I don’t ever want us to be
I don’t ever want us to be
I don’t ever want us to be apart
I don’t ever want us to be
I don’t ever want us to be apart
코카콜라 맛있다
코카콜라 맛있다
See you looking, catch it
Here’s your Cola
See you looking, catch it
Here’s your Cola
코카콜라 맛있다
코카콜라 맛있다
See you looking, catch it
Here’s your Cola
See you looking, catch it
Here’s your Cola
사실 궁금했어
저기선가
내 눈에 띄던 까만 네 글자
Boy, your stylish glow up
got me hooked now, yeah
살짝 짓궂게 보이긴 해도
완전 달달한 너의 그 애교
Liked you from the get go
Sweet함은 그대로
불안감은 ‘제로’
Cuz you know you’re sparkling
like a shooting star
I can see us going far
얼마나 상큼할까
We will pop up all around the world
마법 같은 걸
I’m ready, let’s go
You already know
That I don’t ever want us to be
I don’t ever want us to be
I don’t ever want us to be apart
I don’t ever want us to be
I don’t ever want us to be apart
코카콜라 맛있다
코카콜라 맛있다
See you looking, catch it
Here’s your Cola
See you looking, catch it
Here’s your Cola
코카콜라 맛있다
코카콜라 맛있다
See you looking, catch it
Here’s your Cola
See you looking, catch it
Here’s your Cola
I never ever ever want for us to be apart
That’s a fear puppeteer pulling strings
to my heart
Very serious severely sitting here
inside the dark
Cuz whenever you depart
or disappear I feel parched
All around the world I wonder
where you are
What you doin’
Who you hanging wit
Prolly wit the stars at the party
You the main event
They the undercard
Life changing let ‘em take a sip
They be back tomorrow
Shame shame
I’m still hanging with the same
And lane changing in da range
Da black seats and cream guts ‘bout
to spill my drank
Gas station fill my tank
Rollin’ rollin’ candy paint
Right inside the cup holder
Trying to ignore da phone ranging
JID a Buffalo soldier my mama told me
‘bout da game
Never cared about the fame
But now da whole world know my name
Now I’m off the road I made my quota
no we ain’t da same
If ye’en notice
Chilling really but who the coldest
코카콜라 맛있다
코카콜라 맛있다
See you looking, catch it
Here’s your Cola
See you looking, catch it
Here’s your Cola
코카콜라 맛있다
코카콜라 맛있다
See you looking, catch it
Here’s your Cola
See you looking, catch it
Here’s your Cola",Zero (J.I.D Remix),댄스
Cascade,Arvia Area,36550546,2023.06.21,0,,Cascade,댄스
Highway,헤더,36550542,2023.06.21,4,"Baby 걱정마
어차피 여긴 ground
헛소리 높여봐
어차피 u&i
멈출생각하지말고 가
내일 걱정하지말고 가
더 이상하게 굴어봐
다 괜찮아 we fine
We take ha ha highway
We take ha ha highway
돌아 보지마 이미 멀리야 good bye
도착까지 신호는 없어
우린 ride
멈출생각하지말고 가
내일 걱정하지말고 가
더 이상하게 굴어봐
다 괜찮아 we fine
We take ha ha highway
We take ha ha highway
We take ha ha highway
We take ha ha highway
은빛 바다같이 빛나는 그 위로
부서진 파도가 덮쳐올때까지",Highway,"댄스, 인디음악"
개이득 (Feat. BOBBY),김재환,36545586,2023.06.20,5099,"복잡한 건 다 귀찮아
뒤로 미루고
고민할 필요 뭐 있어
이 리듬에다 Show
Everybody groove tonight
Yeah yeah yeah
오늘 밤은 Crazy
Rock your bang bang
Holiday야 매일매일
심심할 틈 없게
Everybody groove tonight
Yeah yeah yeah
근심 따윈 던져 버리고
내 뜻대로 맘대로 안돼도
느낌이 가는 대로
다 떨쳐버린 채로
Everybody everybody
아싸 개이득
개이득
아싸 개이득 개이득
자기도 큰 자기도
우리 모두 같이 아싸 개이득
아싸 개이득 아싸 개이득
Party like a rock star
내일의 내 일은 내 일이 아니기에 리듬 타
봄바람에 벚꽃 슝 떨어짐 이득이지
얽매는 쩌리 집에 가
Summer time when I Enter
Shamone ladies 줄을 지켜
Roofs on fyah burn things down
워워 위험해 too hot 위험해
오늘 밤은 Crazy
Rock your bang bang
Holiday야 매일매일
심심할 틈 없게
Everybody groove tonight
Yeah yeah yeah
근심 따윈 던져 버리고
내 뜻대로 맘대로 안돼도
느낌이 가는 대로
다 떨쳐버린 채로
Everybody everybody
아싸 개이득
개이득
아싸 개이득 개이득
자기도 큰 자기도 우리 모두 같이 아싸
저리저리 비켜봐 분위기 맞춰봐
이리이리 모여라 다 같이 놀아봐
저리저리 비켜봐 이리이리 모여라
저리저리 이리이리 아싸 개이득
개이득
아싸 개이득 개이득
자기도 큰 자기도
우리 모두 같이 아싸 개이득",J.A.M (Journey Above Music),댄스
