Title,Singer,Song_ID,Release_Date,Like_Count,lyrics,Album,Genre
괜찮지 않나 봐,SATELLITE,36264676,2023.03.10,4,"언제부터였었니 Lose your heart
그녀가 너와 만난다니
What's wrong 오
오 오 믿을 수 없어
I can't believe get away
이제야 말을 하는 이윤 뭐야
내가 널 잊어주면 Just all right 오
오 오 그럼 가버려 I don't care
사실은 지금도 널 원해 Loving You
이렇게 간절히 널 원해 Loving You
네가 없다는 사실 그 때문에
돌아올 거란 헛된 믿음에 나 아파
괜찮을 거야 널 Missing you
잠깐 멀어진 거야 널 Missing you
헌데 눈물이 흘러 잠도 못 자겠어
정신이 멍해 나 괜찮지 않나 봐
모두 다 꿈일 거야 Have a bad dream
돌릴 순 없는 거야 Turn back time 오
오 오 이제 그만해 I need your love
사실은 지금도 널 원해 Loving You
이렇게 간절히 널 원해 Loving You
네가 없다는 사실 그 때문에
돌아올 거란 헛된 믿음에 나 아파
괜찮을 거야 널 Missing you
잠깐 멀어진 거야 널 Missing you
헌데 눈물이 흘러 잠도 못 자겠어
정신이 멍해 나 괜찮지 않나 봐
너 떠나라고 너에게 말한 나지만
솔직히 나 널 보낼 자신 없어
Love love love love love 떠나지 마
지금 돌아온다면 모두 다 잊어줄게
우리 다시 시작해
사실은 지금도 널 원해 Loving You
이렇게 간절히 널 원해 Loving You
네가 없다는 사실 그 때문에
돌아올 거란 헛된 믿음에 나 아파
괜찮을 거야 널 Missing you
잠깐 멀어진 거야 널 Missing you
헌데 눈물이 흘러 잠도 못 자겠어
정신이 멍해 나 괜찮지 않나 봐
괜찮지 않나 봐",괜찮지 않나 봐,댄스
Fiesta (Prod. 정현욱 (뽀선희)),냥금이,36264176,2023.03.10,23,"오랜 시간 끝에 나에게
찾아와준 널 맞이해
이제부터 시작인 거야
우리 둘의 축제
눈을 감아 천천히 날
따라와 줘 yeah
색색의 무지개 있는 곳
바로 이곳에
Fiesta
마법처럼 펼쳐지는 지금 이 순간이
사라지지 않도록 yeah
오직 너를 위한 Present
설레는 순간
Woo Fiesta
Woo yeah woo Fiesta
Woo yeah 기적처럼 반짝이는 Fiesta
네가 내게 항상 그랬듯
조심스레 안아줄게
우리 서로 지나쳤던 시간들
이 밤 잊을래
눈을 감아 천천히 날
따라와 줘 yeah
색색의 무지개 있는 곳
바로 이곳에
Fiesta
마법처럼 펼쳐지는 지금 이 순간이
사라지지 않도록 yeah
오직 너를 위한 Present
설레는 순간
Woo Fiesta
Woo yeah woo Fiesta
Woo yeah 기적처럼 반짝이는 Fiesta
네 눈동자에
비치는 내 모습
감출 수 없어
춤추는 기분
Fiesta
마법처럼 펼쳐지는 지금 이 순간이
사라지지 않도록 yeah
오직 너를 위한 Present
설레는 순간
Woo Fiesta
Woo yeah woo Fiesta
Woo yeah 기적처럼 반짝이는 Fiesta
Woo yeah woo Fiesta
Woo yeah 기적처럼 반짝이는 Fiesta",Fiesta,댄스
기회의 시작(PAINT YOUR COLORS),Leto,36261977,2023.03.10,6,"꿈꿔왔던 밝은 세상
너를 위한 only chance
더 많은 색깔 더 고른 기회
멀게 보였던 순간 점점 선명해져가
다시 꿈을 꿔 당당히 외쳐봐
바래왔던 순간 네 모습 그대로
작은 기회가 하나둘 모여가
모두의 가치로
Come with me and paint your colors
그림으로 시작된 기회 속 네 희망
(What you say)
Come with me and show your colors
그려왔던대로 이뤄질테니까
(what you want)
Woo-oo
세상에 감춰진 기회가
만든 가치를 찾아 떠나
Woo-oo
꿈꿔왔던 dream 이제부터 시작이야
Come with me and paint your colors
그림으로 시작된 기회 속 네 희망
(What you say)
Come with me and show your colors
그려왔던대로 이뤄질테니까
(what you want)",이달의 경기도 Vol.1,댄스
Mysterious,니콜,36257415,2023.03.09,739,"그림을 그려 너가 딱 원하는대로
Left & up down,
oh right there, right there
부드럽게 흘러가는 손 끝자락
Floating like that,
oh right here one more
넌 가만히 내손을 잡은채로 끌어당겨
희미하게 가려진 모습으로 날 찾아와
애 태우려하진 마
급할 필요없잖아
This is my type (uh huh, uh huh)
아슬아슬하게 비추는 mystery
우쭐대다가 너는 곧
switch out, black out
아스라이 귀에 맴도는 fantasy
우리가 되기 전에 불타 올라
Mysterious (ooh yeah, yeah, yeah, yeah)
이 선을 넘어 너도모르게 이끌려올걸
So curious (ooh yeah, yeah, yeah, yeah)
붉게 물들어 넘쳐흐르게 숨막혀올걸
베일을 벗어 난 당당하게
저 앞으로 mightier
몇배를 얹어 난 더 이뤄야만
맘이 fire up
내 머릴 뒤흔드는 지휘속에
Left & up down,
oh right there, right there
더 가려진 비밀의 끝을 잡고 끌어당겨
더 가려하지 않는 미로속에 날 찾아와
숨기려 하진 마
급할 필요 없지만
This is my type
아슬아슬하게 비추는 mystery
우쭐대다가 너는 곧
switch out, black out
아스라이 귀에 맴도는 fantasy
우리가 되기 전에 불타 올라
Mysterious
Left & up down,
oh right there, right there
So curious
Floating like that,
oh right here (one more)
아슬아슬하게 비추는 mystery
우쭐대다가 너는 곧
switch out, black out
아스라이 귀에 맴도는 fantasy
우리가 되기 전에 불타 올라
Mysterious (ooh yeah, yeah, yeah, yeah)
이 선을 넘어 너도모르게 이끌려올걸
So curious (ooh yeah, yeah, yeah, yeah)
붉게 물들어 넘쳐흐르게 숨막혀올걸",Mysterious,댄스
Hug,TO1 (티오원),36257024,2023.03.09,597,"너의 작은 서랍 속의
일기장이 되고 싶어
하루만 네 방의 침대가 되고 싶어
Oh Baby
더 따스히 포근히 내 품에 감싸 안고
재우고 싶어
아주 작은 뒤척임도
너의 조그만 속삭임에
난 꿈속의 괴물도 이겨내 버릴 텐데
내가 없는 너의 하룬
어떻게 흘러가는 건지
나를 얼마나 사랑하는지
난 너무나 궁금한데 (궁금해)
너의 작은 서랍 속의
일기장이 되고 싶어
알 수 없는 너의 그 비밀도
내 맘속에 담아둘래 너 몰래
Ain’t no worry, 지금 널 보니
수 많은 감정들이 머릴 스쳐가
숨은 턱 끝까지 헉
감추 려해봐도
나 너를 향한 마음은..
(Alright) 내 드라마 속엔 매일
바람이 불어 찾기 힘든
green light 네잎
부디 제발 for you
I just wanna hug you
L U V 나를 Follow me
하루만 너의 고양이가 되고 싶어
Oh Baby
네가 주는 맛있는 우유와 부드러운
네 품 안에서
움직이는 장난에도
너의 귀여운 입맞춤에
나도 몰래 질투를 느끼고 있었나 봐
내 마음이 이런 거야
너 밖엔 볼 수 없는 거지
누구를 봐도 어디 있어도
난 너만 바라 보잖아
단 하루만 아주 친한
너의 애인이 되고 싶어
너의 자랑도 때론 투정도
다 들을 수 있을 텐데 널 위해
In My Heart In My Soul
나에게 사랑이란
아직 어색하지만 Uh Uh Babe
이 세상 모든 걸 너에게 주고 싶어
꿈에서라도 Ah
내 마음이 이런 거야
지켜볼 수만 있어도
너무 감사해 많이 행복해
나 조금은 부족해도
언제까지 너의 곁에
연인으로 있고 싶어
너를 내 품에 가득 안은 채
굳어버렸으면 싶어 영원히",Hug,댄스
나쁜X (feat. Baby Tate) [Remix],비비 (BIBI),36255741,2023.03.08,510,"들어오라 해
눈을 깔어 왜
비밀로 할게
네 부정과 죄
전부 드러내
자릴 넘보네
눈감아 줄게
네 본성과 뇌
춤추는 저 장미를 꺾어
완성한 왕관 나의 것
다시는 얼신 못하게
가시를 친 성관
Watch me dance
Watch me sing
여기까진 놓아줄게
도망가 얼른
Watch me dance
Watch me sing
다신 붙잡히지 마
그땐 보게 되는 거야
나쁜년
나쁜년 아주 그냥 나쁜년
나쁜년 아주 그냥 나쁜년
나쁜년 아주 그냥 나쁜년
다신 붙잡히지 마
그땐 보게 되는 거야
미친년
Imma bad bitch
You don’t wanna see me crazy
I’m a grown woman
Don’t be calling me baby
Been through the fire
Your flames don’t phase me
You don’t want the smoke
This shit could get hazy
I let you have your chance
But now I need revenge
It’s far too late to make amends
This is the end
and now you gotta watch me
Watch me dance
Watch me sing
여기까진 놓아줄게
도망가 얼른
Watch me dance
Watch me sing
다신 붙잡히지 마
그땐 보게 되는 거야
나쁜년
나쁜년 아주 그냥 나쁜년
나쁜년 아주 그냥 나쁜년
나쁜년 아주 그냥 나쁜년
다신 붙잡히지 마
그땐 보게 되는 거야
미친년
La BIBI esta loquita
Y necesita un poquito
De agua bendita
Pa que se le quite lo bad bad bad
Bad bitch
Hazle reverencia a tu princess
Dale dale blow some kisses
For her and watch her dance
Perreando en slowmo
Dale BIBI gritalo
It doesn't matter what you did
(what you did, what you did)
What you say you regret
(you regret it all)
I forgave you time & time again
Too bad you lost your last chance
And now
when you see me again I’ll be a
나쁜년 아주 그냥 나쁜년
나쁜년 아주 그냥 나쁜년
나쁜년 아주 그냥 나쁜년
다신 붙잡히지 마
그땐 보게 되는 거야
미친년",나쁜X (feat. Baby Tate) [Remix],댄스
P.O.W! (Play On the World),체리블렛 (Cherry Bullet),36248432,2023.03.07,1339,"Play On the World
Play On the World
So cool하게 겨눠 마치
Sniper처럼 난 P.O.W! P.O.W!
한쪽 눈은 살짝 감지
긴장감은 So tight tight
Woo woo 맘에 들어
It’s good good
(That’s what I want)
날 위한 과녁은 내가 정해
맘대로 멋대로 채워 My paint
(Ah wee)
느낌 없던 이 거릴
휘젓고 망칠 테니
상상만 해도 이미 Good enough
(That’s what I want)
여기저기 다들 말해
I’m the VIP
잔뜩 힘준 목이 지루해만 보이지
똑같은 일상이
재미없어 요즘 난 Yeah
Siren, eh oh eh oh
어지러이
Say that 왜요? 왜요?
참지 않지
Oh I got, 뛰놀아 난
시선은 상관없이
That’s my pleasure pleasure, eh
(That’s what I want)
Play On the World
That’s what I want
That’s what I want
Play On the World
That’s what I want
That’s what I want
Rule은 모두 Break
밤을 비틀 Twilight
That ma choice, go go!
Roll the beat box
무릎 치고 Hands up
점령해 난 Play ground
Woo woo 맘에 들어
It’s good good
(Uh that’s what I want)
느낀 대로 듣고 말해
All my DNA
어떤 답을 내든
결국 찾아 보이지
대놓고 즐길게
날 선 그 걱정들 다 Yeah
Siren, eh oh eh oh
어지러이
Say that 왜요? 왜요?
참지 않지
Oh I got, 뛰놀아 난
시선은 상관없이
That’s my pleasure pleasure, eh
(That’s what I want)
Play On the World
That’s what I want
That’s what I want
Play On the World
That’s what I want
That’s what I want
P.O.W!
어딜 맞히든 맘에 든다면
Perfect 10
P.O.W!
난 방아쇠를 당길수록
커진 꿈을 느껴 Right
더 신나게 가 볼까
넌 원하면 따라와
갖고 놀아 뭐든 다
Play On the World
(That’s what I want)
Play On the World
That’s what I want
(That’s what I want)
That’s what I want
(That’s what I want)
Play On the World
That’s what I want
That’s what I want
Watch me, hello hello
늦기 전에
Catch me, eh oh eh oh
쉽지 않지
Play On the World",Cherry Dash,댄스
비행기 (Feat. 코타 Of Sunnyhill),STEN (스텐),36248332,2023.03.07,445,"철없을 적 내 기억 속에
비행기 타고 가요
파란 하늘 위로 훨훨 날아가겠죠
어려서 꿈꾸었던 비행기 타고
기다리는 동안 아무 말도 못 해요
내 생각 말할 순 없어요
모든 준비 다 끝났어라고 할 땐
사실 아무것도 몰랐어
이제 와서 생각해 보면
어릴 땐 하나하나가
설렜고 그 감정의 파노라마
처음 비행기를 타는 것만 같아 좋았어
어디까지 날아갈까
지금은 내가 어떤 재밌는 걸
해도 설레고 재밌지가 않아서
애써 내색할 순 없어
지금 내가 얼마나 힘들더라도
그걸 참아내며 견디는 게 어른이더라고
어릴 때로 돌아간다면 뭐든 할 거라고
내 어린 시절 좋아했던 노래들이
가사를 보고 공감이 가는 듯이
평범하다고 했던 엄마 아빠가 멋있어
난 언제 어른행 비행기를 탈까
파란 하늘 위로 훨훨 날아가겠죠
어려서 꿈꾸었던 비행기 타고
기다리는 동안 아무 말도 못 해요
내 생각 말할 순 없어요
비행기를 타고 가던 너
따라가고 싶어 울었던
철없을 적 내 기억 속에
비행기 타고 가요
비행기를 타고 멋지게 날고 싶었는데
현실은 뚜벅이에 학교 회사 참 바쁘네
Please don't look at me now
나도 궁금해 멋있었던
내가 왜 점점 작아질까
우울했던 이율 남 탓으로 하지 말고
내가 바보같이 못 했던 걸 변명 말고
이제는 더 높게 더 나은 사람이
되려 비행기를 탈게
조금 부족해도 좀 더 화이팅
수많은 사람들 속을 지나쳐
마지막 게이트야
나도 모르게 안절부절하고 있어
이럴 땐 침착해 좀 자연스럽게
파란 하늘위로 훨훨 날아가겠죠
어려서 꿈꾸었던 비행기 타고
기다리는 동안 아무말도 못해요
내 생각 말할 순 없어요
파란 하늘위로 훨훨 날아가겠죠
어려서 꿈꾸었던 비행기 타고
기다리는 동안 아무말도 못해요
내 생각 말할 순 없어요
비행기를 타고 가던 너
따라가고 싶어 울었던
철없을 적 내 기억속에 비행기 타고가요",비행기 (2023) (Remake),댄스
행운 오빠,백대표,36250494,2023.03.07,1,"해달라면 다 해줄께 내가 행운 오빠
사달라면 다 사줄께 내가 행운 오빠야
다이아몬드 금목걸이 금반지 금두꺼비
니 맘주면 다 사준다
삐까 번쩍 행운 오빠
이 순간 위해서 이십년을 기다렸다
이 순간 위해서 행운을 평생 기다렸다
내가 행운 오빠야 행운 오빠야
행운 오빠야 행운 오빠야
원하는건 다 해줄께 내가 행운 오빠
원한다면 다 사줄께 내가 행운 오빠야
하늘의금도 사다줄게 금팔찌 금부엉이
니 맘주면 다 사준다
삐까 번쩍 행운 오빠
이 순간 위해서 이십년을 기다렸다
이 순간 위해서 행운을 평생 기다렸다
내가 행운 오빠야 행운 오빠야
행운 오빠야 행운 오빠야
내가 행운 내가 행운
내가 행운 내가 행운
내가 행운 오빠야",행운 오빠,댄스
Groovy,CRAVITY,36246285,2023.03.06,10143,"반복된 day and night, 갇힌 suit and tie
숨막힌 틀에 박힌 하루
막 뛰는 심장이 말해 chase the light
주저 말고 take it so good, good
Everybody say
Trippin’ Trippin’ Trippin’ for fun
Drippin’ Drippin’ all night long
짜릿한 기분 like it,
커진 숨소릴 따라 ridin’
Trippin’ Trippin’ Trippin’ for fun
Drippin’ Drippin’ all night long
지금 이 리듬 like it,
자유로운 느낌에 divin’
Look around me
(꿈이 아닌 걸 believe it)
See my heart waves
(터질 듯한 느낌 feel it)
좀 더 빨리
어서 빨리 I need you closer
마주치는 눈빛 속
내 맘이 burning up, 짜릿해져 이 순간
You make me feel so groovy
리듬에 body body movin’
이대로 going crazy for you
빠져들어 이 move
Keepin' it keepin' it groovy
Keepin' it keepin' it groovy
우리 둘만의 something
You make me feel groovy
Yea you know we never gon’ stop
Bring the beat back
너를 품에 안은 채로 돌리고 lean back
너와 나의 groove 마저 lay back
Back back 너를 뒤에 두고 느껴봐
Yeah chillin’,
여기 달빛 아래 우리 groovy drop it
Trippin’ Trippin’ Trippin’ for fun
Drippin’ Drippin’ all night long
지금 이 리듬 like it,
자유로운 느낌에 divin’
Like a spotlight (나를 사로잡는 movin’)
Think I’m falling (벗어날 수 없는 feelin’)
좀 더 빨리
어서 빨리 I need you closer
네게 빠져갈수록
어쩔 수 없는 걸, 전부 너로 가득 차
You make me feel so groovy
리듬에 body body movin’
이대로 going crazy for you
빠져들어 이 move
Keepin' it keepin' it groovy
Keepin' it keepin' it groovy
전부를 네게 줄게
You make me feel groovy
Yea, you make me feel so groovy
You make me feel so groovy
넘칠 듯 너로 채운 music
이대로 going crazy for you
너로 번지는 mood
Keepin' it keepin' it groovy
Keepin' it keepin' it groovy
꿈꿔온 이 순간을
영원히 feel groovy
Keepin' it keepin' it groovy
Keepin' it keepin' it groovy
꿈꿔온 이 순간을
영원히 feel groovy",MASTER : PIECE,댄스
시간이 날 태우고 너에게 데려가 (Time takes me to love),소녀 리버스 (GIRL'S RE:VERSE),36224174,2023.03.06,1441,"어느 날 내 맘속에 피어난 작은 꿈 하나
잠이 든 사이 자라나 나를 가득 채우고
오래된 꿈을 따라 한 걸음씩 달려 어느새
나 서있어 네 눈앞에 반짝이고 있어
끝없이 캄캄한 어둠 속에도 너의
눈빛을 난 알아볼 수 있어
오랫동안 꿈꿔온 날들이 눈 앞에 펼쳐지면
약속했던 것처럼 너와 나 이 자리에 있어
널 몰랐던 그때부터야
기적처럼 우리는
이어져있어 처음부터
하나였던 것처럼 You’re my dream
혼자인 것만 같던 유난히 길었던 밤도
아무도 없는 곳에서 울다 잠들던 날도
모든 날이 널 향해 하나둘씩 쌓여온 듯해
나 서있어 네 눈앞에 반짝이고 있어
너의 맘은 모여 은하수처럼 빛나
날 감싸며 언제나 가득 차
오랫동안 꿈꿔온 날들이 눈앞에 펼쳐지면
약속했던 것처럼 너와 나 이 자리에 있어
널 몰랐던 그때부터야 기적처럼 우리는
이어져있어
처음부터 하나였던 것처럼
You’re my dream
알 수 없는 꿈이 뒤섞였던 그 밤
이젠 알 것만 같아
하나둘셋 하면 눈을 감아봐
이대로 둘만의 세상이 시작된거야
바래왔던 나의 시간들이 눈 앞에 펼쳐지면
주저하지 않고 내 모든걸
더 보여줄거야
널 몰랐던 그때부터야 기적처럼 우리는
이어져있어
처음부터 하나였던 것처럼
In my dream",소녀 리버스(RE:VERSE) - FINAL,댄스
보라빛 향기,YuA (한유아),36244525,2023.03.06,370,"그대 모습은 보라빛처럼
살며시 다가왔지
예쁜 두 눈엔 향기가 어려
잊을 수가 없었네
언제나 우리 웃을 수 있는
아름다운 얘기들을 만들어 가요
외로움이 다가와도
그대 슬퍼 하지마
답답한 내 맘이 더 아파오잖아
길을 걷다 마주치는
많은 사람들 중에
그댄 나에게 사랑을 건네 준 사람
그대 모습은 보라빛처럼
살며시 다가왔지
예쁜 두 눈엔 향기가 어려
잊을 수가 없었네
언제나 우리 웃을 수 있는
아름다운 얘기들을 만들어 가요
외로움이 다가와도
그대 슬퍼 하지마
답답한 내 맘이 더 아파오잖아
길을 걷다 마주치는
많은 사람들 중에
그댄 나에게 사랑을 건네 준 사람",보라빛 향기,댄스
할까 말까,손보라,36242243,2023.03.06,0,"어쩌면 좋아요
당신이 좋아요
사랑을 할까말까
고민하지마 Go!
어쩌면 좋아요
당신만 좋아요
고백을 할까말까
고민하지마 Go!
사랑은 사랑은
직진이래요
이리갔다 저리갔다
하지 않지요
바라보는 마음은
한 길 뿐이죠
좌로 갈까 우로 갈까
하지 않지요
그대는 내 눈에는
최고 최고야
바라보는 내 눈빛은
바보 바보야
그대의 사랑을
내게 보여주세요
당신만 사랑할거야
그대의 사랑만이
그대의 눈길만이
그대의 숨결만이
나를 살게 합니다
어쩌면 좋아요
당신이 좋아요
사랑을 할까말까
고민하지마 Go!
어쩌면 좋아요
당신만 좋아요
고백을 할까말까
고민하지마 Go!
사랑은 사랑은
직진이래요
이리갔다 저리갔다
하지 않지요
바라보는 마음은
한 길 뿐이죠
좌로 갈까 우로 갈까
하지 않지요
그대는 내 눈에는
최고 최고야
바라보는 내 눈빛은
바보 바보야
그대의 사랑을
내게 보여주세요
당신만 사랑할거야
그대의 사랑만이
그대의 눈길만이
그대의 숨결만이
나를 살게 합니다
그대의 사랑만이
그대의 눈길만이
그대의 숨결만이
나를 살게 합니다
어쩌면 좋아요
당신이 좋아요
사랑을 할까말까
고민하지마 Go!
어쩌면 좋아요
당신만 좋아요
고백을 할까말까",할까 말까,댄스
10 Minutes,ICHILLIN' (아이칠린),36234614,2023.03.06,117,"Just One 10 Minutes
내 것이 되는 시간
순진한 내숭에 속아 우는 남자들
Baby 다른 매력에 흔들리고 있잖아
용길 내 봐 다가와
날 가질 수도 있잖아
어느 늦은 밤 혼자 들어선 곳
춤 추는 사람들 그 속에 그녀와 너
왠지 끌리는 널 갖고 싶어져
그녀가 자릴 비운 그 10 분 안에
지루했던 순간이
널 보는 순간 달라졌어
(I'm telling you)
오래된 연인 그게 아니던
중요한 사실은 넌 내게 더 끌리는 것
I say 너의 그녀는 지금 거울을 보며
붉은색 립스틱 화장을 덧칠하고
Baby 높은 구두에 아파하고 있을걸
나는 달라 그녀와 날
비교하지 말아줘
who u think u smakin boy
Dont want any tacky lackin flow
비교하려 시도하다
나란 길로 오기전에
내 촉이 뻔해
puttin on that lip fo deep show
Boy just give me 10 minutes
It’s you and me you know
we got no limits
눈 빛이 달라 그녀는 알까?
이 설렘이 설렘이 가득한 밤
지루했던 순간이
널 보는 순간 달라졌어
(I'm telling you)
오래된 연인 그게 아니던
중요한 사실은 넌 내게 더 끌리는 것
Just One 10 Minutes
내 것이 되는 시간
모든 게 끝난 후 그녀가 오고 있어
Baby 붉은 립스틱 촌스럽기도 하지
내게 와 봐 이제 넌 날
안아봐도 괜찮아
Don't tell a lie just be yourself
힘들게 둘러대지 마
널 떠나달라 말을 해
have it your way
Bling Bling shine
it's right to come
사랑에 빠진 거라고
거짓을 말할 거라면
모두 없던 걸로 해
Just One 10 Minutes
내 것이 되는 시간
순진한 내숭에 속아 우는 남자들
Baby 다른 매력에 흔들리고 있잖아
용길 내 봐 다가와
날 가질 수도 있잖아",THE NEXT : K-POP GIRL GROUPS' VR BATTLE - 10 Minutes,댄스
디스코왕,버스터즈,36234609,2023.03.06,37,"Yeah disco all around the world
you know
Yo J pump me up with the intro
Disco on and on right
Let's go on and on yeah like that
Disco on and on right
Let's go on and on J bump that
오늘도 하루가 힘이 들어
세상 산다는 건 항상 그렇지
왜 그리 답답한 일들뿐야
뭐든 내 뜻대로 되질 않는 걸
언제나 Everybody get down to the beat
Now all the ladies get up off your feet
Move to the left right constantly
Get down to the sound with K Y T now
모두 잊어봐 좋은 내일이 올거야
아직도 살아갈 더 많은 날들이 있잖아
right now oh!
몸을 흔들어봐 이 음악에 빠져
내일 일은 내일에 걱정하면돼
힘껏 소리쳐봐 두 손 높게 들어
저 하늘이 언젠가 답을 줄거야
사랑은 언제야 오는 거야
나의 텅 빈 맘은 항상 외로워
언제 쯤 평온해 지는 거야
온통 시끄러운 소식뿐이야
눈을 감아봐 좋은 기억만 생각해
내곁에 날 믿는 소중한 이들이 있잖아
right now oh!
몸을 흔들어봐 이 음악에 빠져
내일 일은 내일에 걱정하면돼
힘껏 소리쳐봐 두 손 높게 들어
저 하늘이 언젠가 답을 줄거야
뒤를 돌아봐 너무 빨리 걸어온 길
한번쯤 내게도 쉬어갈 여유가 필요해
right now oh!
몸을 흔들어봐 이 음악에 빠져
내일 일은 내일에 걱정하면돼
힘껏 소리쳐봐 두 손 높게 들어
저 하늘이 언젠가 답을 줄거야
everybody get down to the beat
now all the ladies get up off your feet
Move to the left right constantly
get down to the sound
with BUSTERS now
raise em up high, my girl
now throw em up high, my girl
now keep em up high,
now you know it's going on
let's slow it down",THE NEXT : K-POP GIRL GROUPS' VR BATTLE - 디스코왕,댄스
Festival,핑크판타지,36234606,2023.03.06,38,"이제는 웃는 거야 Smile again
행복한 순간이야 Happy days
움츠린 어깨를 펴고 이 세상 속에
힘든 일 모두 지워버려
슬픔은 잊는거야 Never cry
뜨거운 태양 아래 Sunny days
언제나 좋은 일들만 가득하기를
바라면 돼
(항상 똑같은)
생활 속에 지쳐가지만
(나를 누르는)
힘든 일에 쓰러지지만
고개를 숙일 건 없어
그 속에 행복있는 걸 찾으면 돼
나의 주위를 둘러 봐 힘겹다 느낄 때
맑은 어린아이의 모습에 미솔 닮아 봐
이제는 웃는 거야 Smile again
행복한 순간이야 Happy days
움츠린 어깨를 펴고 이 세상 속에
힘든 일 모두 지워버려
슬픔은 잊는거야 Never cry
뜨거운 태양 아래 Sunny days
언제나 좋은 일들만 가득하기를
바라면 돼
조금 낮추어 돌아봐 삶이 무거울 때
아무 말없이 뛰고만 있는 많은 사람들
이제는 웃는 거야
이제는 웃는 거야 Smile again
행복한 순간이야 Happy days
움츠린 어깨를 펴고 이 세상 속에
힘든 일 모두 지워버려
슬픔은 잊는거야 Never cry
뜨거운 태양 아래 Sunny days
언제나 좋은 일들만 가득하기를
바라면 돼
라라라 Smile again
라라라 Happy days
커다란 하늘처럼만 더 크게 웃고
더 크게 생각하는거야
눈물은 잊는거야 Never cry
푸르른 햇살처럼 Sunshine days
언제나 좋은 일들만 가득하기를
기도할게",THE NEXT : K-POP GIRL GROUPS' VR BATTLE - Festival,댄스
