제목,기사 내용,타임스탬프
“신호등 인식 척척… 잦은 급정거는 불안”,"4일 오후 11시 반경 서울 마포구 합정역 정류장에서 시민들이 세계 첫 심야 자율주행버스 ‘심야 A21번’에 탑승하고 있다. 뉴스1



● “생각보다 안정적” vs “급정거 잦아 불안”

서울 종로구 동대문역까지 운행된 버스는 모든 주행 과정이 자동으로 진행됐으며, 돌발 상황에 대비해 운전사가 동승했지만 개입할 일은 없었다. 뉴스1

● 당분간 무료 운행…내년 상반기 유료화

“자율주행 버스에 탑승하신 걸 환영합니다. 안전벨트를 착용해 주세요.”5일 0시 50분. 서울 마포구 합정역에서 ‘심야 A21번’ 버스에 오르며 교통카드를 태그하자 안내방송이 흘러나왔다. 겉보기에는 일반 시내버스와 달라 보이지 않았지만 내부는 달랐다. 운전석에 운전사가 앉아 있긴 했지만 버스가 정류장에 멈추고 출발할 때뿐 아니라 주행 중에도 핸들에 손을 올리지 않았다. 승객이 타고 내릴 때 모두 버스 안팎에 설치된 카메라로 승객을 인식해 자동으로 문이 열리고 닫혔다.실내 좌석은 일반 시내버스와 같은 형태로 배치돼 있었지만 모든 좌석에 안전벨트가 설치돼 있었다. 버스 내부에는 전광판이 설치돼 속도를 알려줬고, 전방 외부 상황을 볼 수 있는 폐쇄회로(CC)TV 화면도 실시간으로 재생됐다.이날 기자가 탑승한 버스는 서울시가 세계 최초로 도입한 심야 자율주행 버스다. 서울시는 그동안 청계천과 청와대, 여의도, 강남, 상암동 등 5곳에서 자율주행 버스를 운행했지만 심야에 운행하는 건 처음이다.노선번호 ‘심야 A21번’ 버스에는 돌발 상황에 대비해 운전사와 특별안전요원이 동행했지만 70분 동안 운행하는 중 한 번도 주행에 개입하지 않았다. 승객들이 모두 안전벨트를 착용하자 합정역에서 출발한 버스는 신촌과 서대문, 종로3가를 지나 동대문역까지 향했다.승객들은 버스가 알아서 차선을 바꾸고 주변 차량을 피하며 좌회전이나 우회전 등을 하는 모습을 보면서 놀라워했다. 또 신호등 신호를 인식해 멈추거나 주행을 재개하는 것에 대해서도 “영화에서나 보던 모습”이란 반응이 나왔다.자율주행버스를 타기 위해 경기 부천시에서 왔다는 마모 씨(37)는 “어렸을 때 상상만 하던 일이 현실이 됐다. 생각보다 주행이 안정적이고 승차감도 일반 버스와 크게 다르지 않아 신기하다”고 했다.반면 버스가 횡단보도나 버스 정거장 앞에서 6, 7분에 한 번꼴로 급정거하는 걸 두고선 우려의 목소리도 나왔다. 직장인 김지훈 씨(28)는 “자율주행이 안전하다고 하는데 아직 개선할 점도 있는 것 같다”고 했다. 서울시 관계자는 “주변 교통 상황을 토대로 버스가 주행 가능한 상황인지 인공지능(AI)이 판단하는데 판단 속도가 늦어지면서 급정거하는 경우가 있다”고 설명했다.심야 A21번 버스는 평일 매일 오후 11시 반∼다음 날 오전 5시 10분 운행한다. 총 2대의 버스가 합정역∼동대문역 9.8km를 순환하는 방식이다. 일반 시내버스처럼 교통카드를 태그하고 타면 되고 입석은 금지된다. 당분간 무료로 운영하고 내년 상반기(1∼6월) 중 노선 연장과 함께 유료화할 방침이다.서울시 관계자는 “자율주행 버스를 통해 중장기적으로 심야 기사 수급 어려움을 해결할 수 있을 것”이라며 “내년 상반기 중 청량리역까지 노선을 확대하고 버스도 추가로 투입하는 방안을 검토 중”이라고 밝혔다.이채완 기자 chaewani@donga.com",2023-12-05 18:09:11
"인천경제청, 내년 인천경제자유구역 교통 불편 해소에 '1370억원 편성'","광역버스 혼잡도 개선 등 올해보다 69.9% 증가…시의회에 증액 요청

IFEZ 교통대책 TF회의 개최…김진용 청장 ""시민 교통불편 해소에 적극 노력""

김진용 인천경제청장 인사말 모습

컨슈머타임스=안우진 기자 | 내년 인천경제청의 교통 분야 예산이 올해보다 563억원 증액될 것으로 전망돼 시민들이 겪는 교통불편이 크게 해소될 것으로 기대된다.

인천경제청은 지난 4일 송도국제도시 G타워에서 '인천경제자유구역(IFEZ) 교통대책 TF' 제2차 회의'를 개최했다고 밝혔다.

인천경제청에 따르면 시의회에 요청한 내년도 IFEZ 교통분야 특별회계 예산 요구안은 총 1368억원으로 올해(805억원)보다 69.9%가 증가했다.

내년 예산은 신규로 편성하거나 증액한 것으로 △광역버스 및 공항 리무진의 혼잡도 개선 지원 △청라국제도시 신교통(GRT) 운영비 지원 △운서역 지하보도 에스컬레이터 설치 △송도·영종·청라국제도시 스마트횡단보도 설치 등에 사용된다.

회의에서는 또 송도 스마트 버스정류장 확대, 영종 대중교통 확충 등 지난 회의에서 건의된 사항과 함께 IFEZ 내 시민 불편사항과 개선 방안 등 교통 환경 개선에 대해 논의했다.

회의에는 IFEZ 교통대책 테스크 포스(TF) 단장인 김진용 인천경제청장을 비롯 주민대표, 인천대 윤병조 교수, 인하대 김용진 교수 등 교통분야 전문가, 인천시, 도로교통공단 등 유관기관 관계자들이 참석했다.

IFEZ 교통대책 TF는 지난 5월 1차 회의를 시작으로 지난 6월과 9월 교통불편 현장점검을 통해 시민들의 어려운 점을 청취했으며 교통환경 개선을 위해 광역교통 배차 추가 등에 사용될 7억원의 예산을 추가로 확보한 바 있다.

김진용 인천경제청장은 ""그동안 IFEZ가 비약적인 성장으로 글로벌 도시로 성장하고 있지만 인구와 통행량 증가로 인한 교통 불편도 증가하고 있다""며 ""앞으로도 TF회의와 현장 점검 등을 통해 시민들의 교통 불편 해소에 적극 노력하겠다""고 말했다.

저작권자 © 컨슈머타임스(Consumertimes) 무단전재 및 재배포 금지",2023-12-05 18:09:12
스키 덕후들 눈돌아가는 국내외 여행지&숙박시설,"스키 시즌의 개막을 시작으로 겨울 스포츠를 즐기려는 수요가 높아질 것으로 예상되는 가운데 호텔스닷컴이 실제 고객 평점을 기반으로 엄선한 국내 및 해외 스키 여행지 리스트를 선보인다.

굿찬, 일본

일본 홋카이도 남서지방에 위치한 굿찬은 고유한 특색과 다채로운 즐길거리로 여행객들을 유혹한다. 니세코 산맥의 관문 역할을 하는 이 지역은 세계적으로 유명한 니세코 스키 리조트로 겨울 스포츠 애호가들을 매료시킨다.

뛰어난 품질의 눈과 여러 종류의 겨울 액티비티로 굿찬은 전 세계의 스키와 스노우보드 애호가들에게 각광받는 지역으로 자리매김하고 있다. 이곳에서 여행객들은 야외 활동의 재미뿐만 아니라 일본의 문화 또한 만끽할 수 있다. 팔색조 같은 매력을 품은 굿찬은 자연 경관, 레크리에이션, 풍부한 문화가 조화롭게 어우러져 모험을 즐기는 이들과 평화로운 한 때를 꿈꾸는 이들을 모두 만족시킨다.

토리피토 호텔&포드 니세코(8.6/10 훌륭해요) 니세코 그랜드 히라후 리조트와 니세코 하나조노 리조트를 포함한 여러 최고급 스키 리조트에서 차로 가까운 거리에 위치해 있어 스키 레벨에 상관없이 모든 여행객들이 스키를 즐길 수 있다.

더 많은 편의를 제공하기 위해 이 숙소는 스키장이나 기차역까지 쉽게 이동할 수 있도록 셔틀 버스 서비스를 지원한다. 추가로 투숙객들은 깨끗하게 관리된 일본식 대욕탕에서 편안하게 피로를 풀 수 있다.

하쿠바, 일본

나가노현에 위치한 하쿠바는 '일본의 알프스'로 불리며 뛰어난 겨울 스포츠 환경으로 유명한 스키 리조트 지역이다. 1998년 동계 올림픽을 개최했던 하쿠바 밸리에는 각기 다른 매력과 실력에 구애를 받지 않고 즐길 수 있는 다양한 스키 코스를 보유한 여러 스키 리조트가 자리하고 있다.

뿐만 아니라 현대적 어메니티와 일본 전통 문화의 조화는 여행객들에게 특별한 경험을 선사한다. 겨울 스포츠에 대한 명성 외에도 하쿠바는 수많은 온천과 눈 부신 경관으로 휴양과 야외 어드벤처를 모두 즐길 수 있는 인기 여행지로 자리 잡고 있다.

호텔 라 네주 히가시칸(9.6/10 최고예요) 하쿠바 밸리 스키 리조트를 포함한 여러 개의 스키 리조트를 가까이 두고 있는 호텔 라 네주 히가시칸은 스키 인 아웃을 지원하여 스키 애호가들에게 이상적인 환경을 제공한다.

이런 환경은 여행객들이 스키 체험 준비를 편리하게 시작하고 마무리 지을 수 있게 하여 보다 원활한 스키 여행 경험을 지원한다. 또한 호텔 라 네주 히가시칸은 투숙객들이 스키와 스노우보드 등 장비를 보관할 수 있는 시설을 제공하며 숙박 경험 만족도를 상승시킨다.

휘슬러, 캐나다

브리티시컬럼비아의 장엄한 코스트 산맥에 둘러싸인 휘슬러는 최고의 휴양지이자 야외 활동의 천국이다. 2010년 동계 올림픽으로 유명세를 얻은 휘슬러는 스키와 스노우보드를 포함한 특별한 겨울 액티비티와 고산지대가 가진 아름다움으로 여행객들의 마음을 사로잡는다.

보행자 친화적인 휘슬러 빌리지는 상점, 레스토랑, 문화 명소가 특색 있게 어우러져 따뜻하고 포근한 분위기를 조성해 편안함을 더한다. 이렇듯 웅장한 알프스 풍경과 각종 레크리에이션으로 유명한 휘슬러는 겨울을 좋아하는 여행객들에게 꾸준히 사랑받는 여행지이다.

레전드 휘슬러(9.0/10 매우 훌륭해요) 이 아파트 스타일의 럭셔리 호텔은 휘슬러 블랙콤 스키 리조트와 가까운 최적의 입지를 자랑하며 스키 인 아웃이 가능해 겨울 스포츠 애호가들에게 편리함을 보장한다.

여행객들은 스키 외에 인근에서 아이스 스케이팅, 짚 트레킹 등 다양한 액티비티를 즐길 수 있다. 또한 눈 위에서 즐거운 하루를 보낸 후에 숙소로 돌아와 라운지 바에서 여유로운 시간을 보내며 아늑한 휴식을 취할 수 있다.

이 호텔의 매력 중 하나인 벽난로는 몸과 마음에 따뜻함을 더해주며 호텔의 스파는 여행객들이 총체적으로 만족스러운 경험을 할 수 있도록 기여한다.

샤모니 몽 블랑, 프랑스

아름다운 프랑스 알프스 산맥에 자리한 샤모니 몽 블랑은 아웃도어 모험가를 위한 최고의 여행지다. 프랑스, 스위스, 이탈리아 국경 근처에 전략적으로 위치한 샤모니 몽 블랑은 세계 최고 수준의 스키 경험과 등산 기회로 여행객들을 끌어 들인다.

겨울 스포츠의 스릴 외에 고산지대 문화, 고풍스러운 거리, 경이로운 풍경이 유쾌하게 어우러진 도시다. 활기찬 시내 중심가를 거닐거나 난이도 높은 슬로프를 정복하는 등 여행객들은 이 특별한 산악 휴양지에서 잊을 수 없는 경험을 하게 될 것이다.

오텔 르 레퓨지 데 에글론(8.6/10 훌륭해요) 샤모니 몽 블랑의 생기 넘치는 중심부에 위치한 고급 휴양지다. 버스 정류장 및 케이블카와의 높은 접근성을 자랑하며 이를 통해 여행객들은 각각의 다른 특색을 지닌 인근 스키 지역으로 편리하게 이동할 수 있다.

이 호텔은 짜릿한 스노우 어드벤처뿐만 아니라 활력 회복을 돕는 스파와 레스토랑 등의 부대시설을 갖추고 있어 다양한 취향을 충족시킨다. 유리한 위치적 조건과 더불어 마사지, 바디 스크럽, 종합 바디 트리트먼트 등 각종 서비스를 제공하는 이 호텔은 여행객들이 폭넓은 야외 활동과 완벽한 휴식을 만끽할 수 있도록 지원한다.

평창, 한국

2018년 동계 올림픽과 패럴림픽 개최로 위상을 떨친 평창은 그림 같은 풍경과 산악지대를 자랑하며 겨울 스포츠를 즐기기에 완벽한 환경을 제공한다. 늦가을부터 시작되는 추운 날씨 덕분에 이 곳의 스키 시즌은 타 지역에 비해 일찍 시작된다.

서리가 내리는 날씨가 시작되면서 스키 애호가들은 벌써부터 눈 속에서 즐길 수 있는 액티비티 준비에 박차를 가하고 있다. 특히 강원도의 스키 시즌이 11월 말부터 시작됨에 따라 겨울철 여행객들의 기대가 커지고 있다.

라마다 호텔 & 스위트 바이 윈덤 강원 평창(8.8/10 훌륭해요) 알펜시아 리조트와 용평 리조트에 인접해 있어 여행객들이 자신의 취향에 따라 유연하게 스키 경험을 선택할 수 있도록 지원한다. 편의성을 더욱 높이기 위해 해당 숙소에서는 스키장을 오가는 셔틀 버스 서비스를 제공하고 있다.

또한 조용하고 한적한 환경으로 환대하는 분위기를 선사한다. 신나게 눈 속을 누빈 후 투숙객들은 한국의 문화가 투영된 호텔 내 한국식 스파와 사우나에서 몸을 녹이며 휴식을 취할 수 있다.

사진= 호텔스닷컴",2023-12-05 18:09:14
버스정류장점령한 불법 주정차,SNS 기사보내기 카카오스토리(으)로 기사보내기 카카오톡(으)로 기사보내기 URL복사(으)로 기사보내기 이메일(으)로 기사보내기 다른 공유 찾기 기사스크랩하기,2023-12-05 18:09:16
막 오른 스키 시즌…국내외 인기 스키 여행지 5,"스키 시즌이 시작됐다. 호텔스닷컴 코리아 플랫폼 내 검색 데이터 트렌드에 따르면, 겨울 스포츠 애호가들은 이미 이상적인 스키 여행을 위한 계획을 수립하고 있으며, 홋카이도와 나가노 등의 여행지들이 인기를 끌고 있는 것으로 나타났다. 호텔스닷컴이 실제 고객 평점을 기반으로 엄선한 국내 및 해외 스키 여행지 리스트를 선보였다.

평창, 한국

2018년 동계 올림픽과 패럴림픽 개최로 위상을 높인 평창은 그림 같은 풍경과 산악지대 속 겨울 스포츠를 즐기기에 완벽한 환경을 갖추고 있다. 늦가을부터 시작되는 추운 날씨 덕분에 이곳의 스키 시즌은 11월 말부터로 다른 지역에 비해 일찍 시작된다.

라마다 호텔 & 스위트 바이 윈덤 강원 평창 / 호텔스닷컴

라마다 호텔 & 스위트 바이 윈덤 강원 평창은 알펜시아 리조트와 용평 리조트에 인접해 있어 여행객들이 자신의 취향에 따라 유연한 스키장을 선택할 수 있다. 호텔에서 스키장을 오가는 셔틀 버스 서비스를 제공하는 한편 한국식 스파와 사우나에서 몸을 녹이며 휴식을 취할 수도 있다.

굿찬, 일본

일본 홋카이도 남서지방에 위치한 굿찬은 고유한 특색과 다채로운 즐길거리로 여행객들을 유혹한다. 호텔스닷컴 코리아 플랫폼에 따르면, 11월 홋카이도 여행 검색량은 지난달 대비 45% 급증했다. 니세코 산맥의 관문 역할을 하는 이 지역은 뛰어난 품질의 눈과 여러 종류의 겨울 액티비티, 세계적으로 유명한 니세코 스키 리조트로 겨울 스포츠 애호가들을 매료시킨다.

일본 굿찬에 위치한 스키 리조트 / 호텔스닷컴

토리피토 호텔&포드 니세코는 니세코 그랜드 히라후 리조트와 니세코 하나조노 리조트를 포함한 여러 최고급 스키 리조트에서 차로 가까운 거리에 위치해 있다. 스키장이나 기차역까지 쉽게 이동할 수 있도록 셔틀 버스 서비스를 지원한다. 일본식 대욕탕에서 편안하게 피로를 풀 수도 있다.

하쿠바, 일본

나가노현에 위치한 하쿠바는 일본의 알프스로 불리며, 뛰어난 겨울 스포츠 환경으로 유명한 스키 리조트 지역이다. 호텔스닷컴 코리아 플랫폼에 따르면, 올해 11월 나가노의 검색량은 10월 대비 20% 증가한 것으로 나타났다. 1998년 동계 올림픽을 개최했던 하쿠바 밸리에는 각기 다른 매력과 실력에 구애를 받지 않고 즐길 수 있는 다양한 스키 코스를 보유한 여러 스키 리조트가 있다. 또 온천과 멋진 자연 경관으로 휴양과 야외 어드벤처를 모두 즐길 수 있는 인기 여행지로 자리 잡고 있다.

라 네주 히가시칸 외관 / 호텔스닷컴

호텔 라 네주 히가시칸은 하쿠바 밸리 스키 리조트를 포함한 여러 개의 스키 리조트를 가까이 두고 있다. 보다 원활한 스키 여행 경험을 위해 투숙객들이 스키와 스노우보드 등 장비를 보관할 수 있는 서비스도 제공한다.

휘슬러, 캐나다

브리티시컬럼비아의 장엄한 코스트 산맥에 둘러싸인 휘슬러는 야외 활동의 천국이다. 2010년 동계 올림픽으로 유명세를 얻은 휘슬러는 스키와 스노우보드를 포함한 특별한 겨울 액티비티와 고산지대가 가진 아름다움으로 여행객들의 마음을 사로잡는다. 휘슬러 빌리지는 상점, 레스토랑, 문화 명소가 특색 있게 어우러져 따뜻하고 포근한 분위기를 조성한다.

캐나다 휘슬러의 대표 숙소 레전드 휘슬러 / 호텔스닷컴

레전드 휘슬러는 휘슬러 블랙콤 스키 리조트와 가까운 곳에 위치한 아파트먼트 스타일의 럭셔리 호텔이다. 스키 인‧아웃도 가능하다. 호텔의 매력 중 하나는 몸과 마음에 따뜻함을 더해주는 벽난로다.

샤모니 몽 블랑, 프랑스

아름다운 프랑스 알프스 산맥에 자리한 샤모니 몽 블랑은 아웃도어 모험가를 위한 여행지로 손꼽힌다. 프랑스, 스위스, 이탈리아 국경 근처에 위치한 샤모니 몽 블랑은 세계적인 수준의 스키 경험과 등산 경험으로 여행객들의 발걸음을 모은다. 겨울 스포츠 외에도 고산지대 문화, 고풍스러운 거리, 아름다운 풍경이 유쾌하게 어우러진 도시이기도 하다.

프랑스 샤모니 몽 블랑에 위치한 스키 활주로 / 호텔스닷컴

오텔 르 레퓨지 데 에글론은 샤모니 몽 블랑의 생기 넘치는 중심부에 위치한 고급 휴양지다. 버스 정류장 및 케이블카와의 높은 접근성을 자랑하기도 한다. 마사지, 바디 스크럽, 바디 트리트먼트 등의 서비스를 제공하는 스파와 레스토랑 등의 부대시설도 갖추고 있다.",2023-12-05 18:09:17
승객이 안전벨트 매야 출발…급정거 등 승차감 개선은 과제,"지난 4일 밤 자정 무렵, 낯선 외관의 버스가 서울 동대문역 시내버스 정류장에 들어섰다. 시민들 시선이 버스 쪽으로 쏠렸다. 앞엔 ‘심야 A21’, 옆엔 ‘서울 심야 자율주행 버스’라고 적혀 있었다. 숫자 앞에 ‘N(Night·밤)’이 붙는 기존 심야버스와 달리 이 버스는 ‘A(Autonomous·자율)’였다. 서울시가 이날부터 심야 자율주행 버스 운행을 시작했다. 대중교통 기능의 자율주행 버스가 심야에 정기 운행하는 것은 전 세계 처음이다. 두 대를 운영하는데, 한 대씩 합정역~동대문역 구간을 서로 엇갈려 오간다. 약 9.8㎞ 구간이며, 광화문과 종로, 신촌, 홍대입구역 등을 지난다. 오후 11시30분부터 다음날 오전 5시10분까지 운행하고, 배차 간격은 70분이다.

중앙일보 취재진은 이날 심야 자율주행 버스에 탑승해 첫 시험운행 상황을 점검했다. 교통카드를 단말기에 대자 여느 버스처럼 ‘삑’ 소리가 났다. 요금(기본요금 2500원)은 결제되지 않았다. 당분간 무료이며, 내년 상반기 중 안정됐다고 판단되면 유료로 전환한다. 좌석은 총 21개인데, 안전벨트가 눈에 띄었다. 버스 운영사(SUM) 관계자는 “모든 승객이 안전벨트를 착용한 걸 확인한 뒤 버스가 출발한다”고 설명했다. 안전사고 예방을 위해 입석 금지다. 모두 안전벨트를 하자 버스가 출발했다. 최고 속도는 시속 50㎞인데, 이날은 시속 40㎞ 안팎으로 달렸다. 곡선 구간도 예상보다 부드럽게 지났다.

운행 중 운전석의 ‘시험운전자’는 운전대에서 손을 뗀 상태였다. 운전석 건너편 ‘오퍼레이터’와 가끔 도로 상황 등을 얘기했다. 시험운전자는 돌발 상황에 대비하기 위해 탑승한다. 시험운전자가 운행 도중 머리 위로 두 팔을 올리자 승객들이 탄성을 내기도 했다. 동대문역에서 출발한 버스는 1시간 만에 합정역에 도착했다. 다행히 돌발 상황이 없었다. 다만 승차감은 풀어야 할 숙제로 보인다. 외부 불빛이나 옆 차선 큰 차에 센서가 반응하면서 버스가 몇 차례 급정거했고, 놀란 승객들이 창밖을 살폈다.

자정을 지나 아현역에서 탑승한 직장인 백모(30)씨는 “심야에 편리하게 이용할 수 있을 것 같다”면서도 “탑승감은 편안한 느낌은 아니었다”고 평가했다. 서울시 관계자는 “시험·실제 운행을 통해 데이터가 쌓이면 승객이 느끼는 승차감은 훨씬 좋아질 것”이라고 설명했다. 또 취객 난동 등의 우려에는 “심야(N)버스 운영에서 쌓은 경험을 토대로 적절하게 대응하겠다”고 말했다.",2023-12-05 18:09:19
2028년 대전 도시철도 2호선 개통...시민의 평가는,"6일 이장우 대전시장이 12월 확대간부회의를 주재하고 있다. 생방송 갈무리

유득원 대전시 행정부시장이 5일 확대간부에서 '불위호성'을 강조하고 있다. 생방송 갈무리

이장우 대전시장은 5일 12월 확대간부회의에서 도시철도 2호선 트램 착공을 비롯해 도시철도 3⋅4⋅5호선 계획, 타슈 등 도시 발전 계획에 대한 정책 방향을 제시했다.우선 한대희 도시철도정책과 사무관은 2028년 대전 도시철도 2호선 개통 시 시민의 긍정적인 평가를 받기 위해 부서별, 5개구별 역할과 협력안을 설명했다.이를 위해 종합계획을 수립하고 TF(task force)팀을 구성해 운영해야 한다고 말하고 신호체계와 버스 노선, 주차금지 구역은 용역이 필요하다고 밝혔다.이에 대해 이장우 대전시장은 “트램 착공이 시작하면 교통문제로 인한 시민불편이 예상된다""며 ""부시장님을 중심으로 부서장이 협업하고 5개 구청도 협력해 시민불편 최소화 방안을 마련하라""고 지시했다.특히 ""도시철도 2호선은 'X'(엑스)모양이 아닌 순환선이므로 도시발전의 장기적인 측면에서 생각해 보면 도시철도 3⋅4⋅5호선 계획이 같이 수립되어야 한다""며 철길 없이 달릴 수 있는 바퀴 달린 트램 도입도 고려하고 있다고 밝혔다.이장우 대전시장은 지난 지방선거 후보시절부터 ""도시철도 3⋅4⋅5호선 계획이 큰틀에서 동시에 구상되어야 한다""며 ""그때 그때 임시 방편으로 계획된다면 도시발전에 도움이 안 된다""고 주장했다.아울러 이 시장은 타슈 확충과 유지관리 필요성을 점검하면서 “타슈를 지하철과 버스 정류장 주변에 많이 배치하라""며 ""타슈를 늘리는 것도 필요하지만, 유지관리가 무엇보다 중요하다”고 말하며 ""대전교통공사는 파손 없이 시민들이 탈 수 있도록 홍보 방안을 마련하라""고 강조했다.더불어 도시 미관과 안전을 위해 통신·전선 지중화를 언급하며 “내년부터 예산을 반영해 지중화 작업에 적극적으로 나서”라며 “이는 유사시 국가 안보 문제도 있다”고 설명했다.이에 앞서 신임 유득원 행정부시장은 ""공무원 각 개인이 일류가 된다면 우리 도시가 일류 경제도시가 된다""며 불위호성을 강조하며 ""보람있게 일하고 소통하면서 어려운 문제도 풀어 가겠다""고 밝혔다.이석봉 경제과학부시장은 8일 퇴임식을 앞두고 ""일 잘하는 이장우 시장님을 모시고 1년 4개월 동안 뜻깊게 공직생활을 했다""며 ""앞으로도 대전발전에 힘을 보태겠다""고 말했다.그 외에도 이 시장은 도시브랜드 가치를 높이기 위한 디자인과 대전의 기본 컬러인 녹색을 상징화하는 작업, 대전의 자긍심을 높이기 위해 홍보, 하나캐피탈 차고지 마련, 산업단지 활성화, 청년 주택 매입 등을 점검했다.대전=명정삼 기자 mjsbroad@kukinews.com 기사모아보기",2023-12-05 18:09:20
