제목,기사 내용,타임스탬프
막 오른 스키 시즌…국내외 인기 스키 여행지 5,"스키 시즌이 시작됐다. 호텔스닷컴 코리아 플랫폼 내 검색 데이터 트렌드에 따르면, 겨울 스포츠 애호가들은 이미 이상적인 스키 여행을 위한 계획을 수립하고 있으며, 홋카이도와 나가노 등의 여행지들이 인기를 끌고 있는 것으로 나타났다. 호텔스닷컴이 실제 고객 평점을 기반으로 엄선한 국내 및 해외 스키 여행지 리스트를 선보였다.

평창, 한국

2018년 동계 올림픽과 패럴림픽 개최로 위상을 높인 평창은 그림 같은 풍경과 산악지대 속 겨울 스포츠를 즐기기에 완벽한 환경을 갖추고 있다. 늦가을부터 시작되는 추운 날씨 덕분에 이곳의 스키 시즌은 11월 말부터로 다른 지역에 비해 일찍 시작된다.

라마다 호텔 & 스위트 바이 윈덤 강원 평창 / 호텔스닷컴

라마다 호텔 & 스위트 바이 윈덤 강원 평창은 알펜시아 리조트와 용평 리조트에 인접해 있어 여행객들이 자신의 취향에 따라 유연한 스키장을 선택할 수 있다. 호텔에서 스키장을 오가는 셔틀 버스 서비스를 제공하는 한편 한국식 스파와 사우나에서 몸을 녹이며 휴식을 취할 수도 있다.

굿찬, 일본

일본 홋카이도 남서지방에 위치한 굿찬은 고유한 특색과 다채로운 즐길거리로 여행객들을 유혹한다. 호텔스닷컴 코리아 플랫폼에 따르면, 11월 홋카이도 여행 검색량은 지난달 대비 45% 급증했다. 니세코 산맥의 관문 역할을 하는 이 지역은 뛰어난 품질의 눈과 여러 종류의 겨울 액티비티, 세계적으로 유명한 니세코 스키 리조트로 겨울 스포츠 애호가들을 매료시킨다.

일본 굿찬에 위치한 스키 리조트 / 호텔스닷컴

토리피토 호텔&포드 니세코는 니세코 그랜드 히라후 리조트와 니세코 하나조노 리조트를 포함한 여러 최고급 스키 리조트에서 차로 가까운 거리에 위치해 있다. 스키장이나 기차역까지 쉽게 이동할 수 있도록 셔틀 버스 서비스를 지원한다. 일본식 대욕탕에서 편안하게 피로를 풀 수도 있다.

하쿠바, 일본

나가노현에 위치한 하쿠바는 일본의 알프스로 불리며, 뛰어난 겨울 스포츠 환경으로 유명한 스키 리조트 지역이다. 호텔스닷컴 코리아 플랫폼에 따르면, 올해 11월 나가노의 검색량은 10월 대비 20% 증가한 것으로 나타났다. 1998년 동계 올림픽을 개최했던 하쿠바 밸리에는 각기 다른 매력과 실력에 구애를 받지 않고 즐길 수 있는 다양한 스키 코스를 보유한 여러 스키 리조트가 있다. 또 온천과 멋진 자연 경관으로 휴양과 야외 어드벤처를 모두 즐길 수 있는 인기 여행지로 자리 잡고 있다.

라 네주 히가시칸 외관 / 호텔스닷컴

호텔 라 네주 히가시칸은 하쿠바 밸리 스키 리조트를 포함한 여러 개의 스키 리조트를 가까이 두고 있다. 보다 원활한 스키 여행 경험을 위해 투숙객들이 스키와 스노우보드 등 장비를 보관할 수 있는 서비스도 제공한다.

휘슬러, 캐나다

브리티시컬럼비아의 장엄한 코스트 산맥에 둘러싸인 휘슬러는 야외 활동의 천국이다. 2010년 동계 올림픽으로 유명세를 얻은 휘슬러는 스키와 스노우보드를 포함한 특별한 겨울 액티비티와 고산지대가 가진 아름다움으로 여행객들의 마음을 사로잡는다. 휘슬러 빌리지는 상점, 레스토랑, 문화 명소가 특색 있게 어우러져 따뜻하고 포근한 분위기를 조성한다.

캐나다 휘슬러의 대표 숙소 레전드 휘슬러 / 호텔스닷컴

레전드 휘슬러는 휘슬러 블랙콤 스키 리조트와 가까운 곳에 위치한 아파트먼트 스타일의 럭셔리 호텔이다. 스키 인‧아웃도 가능하다. 호텔의 매력 중 하나는 몸과 마음에 따뜻함을 더해주는 벽난로다.

샤모니 몽 블랑, 프랑스

아름다운 프랑스 알프스 산맥에 자리한 샤모니 몽 블랑은 아웃도어 모험가를 위한 여행지로 손꼽힌다. 프랑스, 스위스, 이탈리아 국경 근처에 위치한 샤모니 몽 블랑은 세계적인 수준의 스키 경험과 등산 경험으로 여행객들의 발걸음을 모은다. 겨울 스포츠 외에도 고산지대 문화, 고풍스러운 거리, 아름다운 풍경이 유쾌하게 어우러진 도시이기도 하다.

프랑스 샤모니 몽 블랑에 위치한 스키 활주로 / 호텔스닷컴

오텔 르 레퓨지 데 에글론은 샤모니 몽 블랑의 생기 넘치는 중심부에 위치한 고급 휴양지다. 버스 정류장 및 케이블카와의 높은 접근성을 자랑하기도 한다. 마사지, 바디 스크럽, 바디 트리트먼트 등의 서비스를 제공하는 스파와 레스토랑 등의 부대시설도 갖추고 있다.",2023-12-05 18:18:42
승객이 안전벨트 매야 출발…급정거 등 승차감 개선은 과제,"지난 4일 밤 자정 무렵, 낯선 외관의 버스가 서울 동대문역 시내버스 정류장에 들어섰다. 시민들 시선이 버스 쪽으로 쏠렸다. 앞엔 ‘심야 A21’, 옆엔 ‘서울 심야 자율주행 버스’라고 적혀 있었다. 숫자 앞에 ‘N(Night·밤)’이 붙는 기존 심야버스와 달리 이 버스는 ‘A(Autonomous·자율)’였다. 서울시가 이날부터 심야 자율주행 버스 운행을 시작했다. 대중교통 기능의 자율주행 버스가 심야에 정기 운행하는 것은 전 세계 처음이다. 두 대를 운영하는데, 한 대씩 합정역~동대문역 구간을 서로 엇갈려 오간다. 약 9.8㎞ 구간이며, 광화문과 종로, 신촌, 홍대입구역 등을 지난다. 오후 11시30분부터 다음날 오전 5시10분까지 운행하고, 배차 간격은 70분이다.

중앙일보 취재진은 이날 심야 자율주행 버스에 탑승해 첫 시험운행 상황을 점검했다. 교통카드를 단말기에 대자 여느 버스처럼 ‘삑’ 소리가 났다. 요금(기본요금 2500원)은 결제되지 않았다. 당분간 무료이며, 내년 상반기 중 안정됐다고 판단되면 유료로 전환한다. 좌석은 총 21개인데, 안전벨트가 눈에 띄었다. 버스 운영사(SUM) 관계자는 “모든 승객이 안전벨트를 착용한 걸 확인한 뒤 버스가 출발한다”고 설명했다. 안전사고 예방을 위해 입석 금지다. 모두 안전벨트를 하자 버스가 출발했다. 최고 속도는 시속 50㎞인데, 이날은 시속 40㎞ 안팎으로 달렸다. 곡선 구간도 예상보다 부드럽게 지났다.

운행 중 운전석의 ‘시험운전자’는 운전대에서 손을 뗀 상태였다. 운전석 건너편 ‘오퍼레이터’와 가끔 도로 상황 등을 얘기했다. 시험운전자는 돌발 상황에 대비하기 위해 탑승한다. 시험운전자가 운행 도중 머리 위로 두 팔을 올리자 승객들이 탄성을 내기도 했다. 동대문역에서 출발한 버스는 1시간 만에 합정역에 도착했다. 다행히 돌발 상황이 없었다. 다만 승차감은 풀어야 할 숙제로 보인다. 외부 불빛이나 옆 차선 큰 차에 센서가 반응하면서 버스가 몇 차례 급정거했고, 놀란 승객들이 창밖을 살폈다.

자정을 지나 아현역에서 탑승한 직장인 백모(30)씨는 “심야에 편리하게 이용할 수 있을 것 같다”면서도 “탑승감은 편안한 느낌은 아니었다”고 평가했다. 서울시 관계자는 “시험·실제 운행을 통해 데이터가 쌓이면 승객이 느끼는 승차감은 훨씬 좋아질 것”이라고 설명했다. 또 취객 난동 등의 우려에는 “심야(N)버스 운영에서 쌓은 경험을 토대로 적절하게 대응하겠다”고 말했다.",2023-12-05 18:18:44
2028년 대전 도시철도 2호선 개통...시민의 평가는,"6일 이장우 대전시장이 12월 확대간부회의를 주재하고 있다. 생방송 갈무리

유득원 대전시 행정부시장이 5일 확대간부에서 '불위호성'을 강조하고 있다. 생방송 갈무리

이장우 대전시장은 5일 12월 확대간부회의에서 도시철도 2호선 트램 착공을 비롯해 도시철도 3⋅4⋅5호선 계획, 타슈 등 도시 발전 계획에 대한 정책 방향을 제시했다.우선 한대희 도시철도정책과 사무관은 2028년 대전 도시철도 2호선 개통 시 시민의 긍정적인 평가를 받기 위해 부서별, 5개구별 역할과 협력안을 설명했다.이를 위해 종합계획을 수립하고 TF(task force)팀을 구성해 운영해야 한다고 말하고 신호체계와 버스 노선, 주차금지 구역은 용역이 필요하다고 밝혔다.이에 대해 이장우 대전시장은 “트램 착공이 시작하면 교통문제로 인한 시민불편이 예상된다""며 ""부시장님을 중심으로 부서장이 협업하고 5개 구청도 협력해 시민불편 최소화 방안을 마련하라""고 지시했다.특히 ""도시철도 2호선은 'X'(엑스)모양이 아닌 순환선이므로 도시발전의 장기적인 측면에서 생각해 보면 도시철도 3⋅4⋅5호선 계획이 같이 수립되어야 한다""며 철길 없이 달릴 수 있는 바퀴 달린 트램 도입도 고려하고 있다고 밝혔다.이장우 대전시장은 지난 지방선거 후보시절부터 ""도시철도 3⋅4⋅5호선 계획이 큰틀에서 동시에 구상되어야 한다""며 ""그때 그때 임시 방편으로 계획된다면 도시발전에 도움이 안 된다""고 주장했다.아울러 이 시장은 타슈 확충과 유지관리 필요성을 점검하면서 “타슈를 지하철과 버스 정류장 주변에 많이 배치하라""며 ""타슈를 늘리는 것도 필요하지만, 유지관리가 무엇보다 중요하다”고 말하며 ""대전교통공사는 파손 없이 시민들이 탈 수 있도록 홍보 방안을 마련하라""고 강조했다.더불어 도시 미관과 안전을 위해 통신·전선 지중화를 언급하며 “내년부터 예산을 반영해 지중화 작업에 적극적으로 나서”라며 “이는 유사시 국가 안보 문제도 있다”고 설명했다.이에 앞서 신임 유득원 행정부시장은 ""공무원 각 개인이 일류가 된다면 우리 도시가 일류 경제도시가 된다""며 불위호성을 강조하며 ""보람있게 일하고 소통하면서 어려운 문제도 풀어 가겠다""고 밝혔다.이석봉 경제과학부시장은 8일 퇴임식을 앞두고 ""일 잘하는 이장우 시장님을 모시고 1년 4개월 동안 뜻깊게 공직생활을 했다""며 ""앞으로도 대전발전에 힘을 보태겠다""고 말했다.그 외에도 이 시장은 도시브랜드 가치를 높이기 위한 디자인과 대전의 기본 컬러인 녹색을 상징화하는 작업, 대전의 자긍심을 높이기 위해 홍보, 하나캐피탈 차고지 마련, 산업단지 활성화, 청년 주택 매입 등을 점검했다.대전=명정삼 기자 mjsbroad@kukinews.com 기사모아보기",2023-12-05 18:18:45
전주 시내버스난폭운전 여전 '민원 빗발',"사고 끊이지 않아 ‘대책 시급’

불편신고 ‘무정차’ 가장 많아

시, 암행감찰·모니터링 강화 지속



전주시가 시내버스 서비스 개선을 위한 여러 방책을 내놓고 있지만 여전히 시민들의 민원이 빗발치고 있는 것으로 나타났다.

급정거, 급출발 등 난폭운전은 근절되지 않고, 이로 인해 매해 교통사고가 끊임없이 발생하고 있어 대책마련이 시급하다는 목소리다.

5일 교통사고분석시스템(TAAS)에 따르면 최근 3년간(2020~2022년) 전주시 시내버스 교통사고는 총 161건이다.

연도별로 보면 2020년 46건, 2021년 45건, 2022년 70건으로 지난해 급격히 늘어난 것으로 집계됐다.

또 지난해 전주시 시내버스 관련 불편 민원이 총 2020건으로 나타났다. 발생 건수 중 무정차가 710건으로 가장 많았고, 결행 등 355건, 난폭운전 321건, 불친절 308건, 승차거부중도하차 56건 순이다.

이에 본보는 전주 시내버스의 서비스 실태를 확인하기 위해 버스를 탑승해 본 결과 급출발, 급정거, 무정차 등 여러 문제점이 드러났다.

승객이 자리에 않기도 전에 출발하는가 하면, 하차 벨을 누른 승객이 버스에서 완전히 내리기도 전에 문이 닫힌다는 경고음이 울리기도 했다.

승객들은 버스에서 내리지 못할 수 있다는 우려 때문인지 움직이는 버스 안에서 바쁜 걸음을 재촉했다.

버스 정류장마다 흘러나오는 주행 중 안전에 관한 안내방송이 무색한 순간이었다.

함께 버스를 탄 어르신은 ""한동안 버스 안전 운전에 관해 기사들에게 정중하게 양해를 부탁했지만 돌아오는 거라곤 불친절한 대답 뿐이었다""며 ""몇일전에는 버스 손잡이를 꽉 쥔 채로 서 있었으나 버스가 갑자기 급정거 하는 바람에 중심을 잃고 뒤로 넘어진 적도 있다""고 토로했다.

이날 1시간 가량 총 5대의 시내버스를 탑승해본 결과 급출발, 급정거 등 난폭 운전을 하지 않은 버스는 1대에 불과했다.

이처럼 시내 버스 서비스와 관련 민원이 지속되고 있는 가운데 전주시도 이를 해결하기 위한 시민 모니터링단, 암행감찰단 등의 정책을 내놓고 있다.

하지만 전주시가 내놓은 정책들로는 근본적인 해결책이 될 수 없다고 버스기사들은 지적했다.

전주의 한 시내버스 기사는 ""열악한 근무환경과 인력 부족 등으로 인한 배차간격이 짧아지면서 시내버스의 난폭운전 문제도 심화되고 있다""며 ""또 구간에 늦게 도착하면 안되기 때문에 러쉬아워 시간에는 차가 막혀 정시 도착을 장담할 수 없다. 버스기사에 초점을 맞출게 아니라 근본적인 해결책을 마련해야 하는게 우선시 되어야 한다""고 말했다.

이와 관련해 전주시 관계자는 ""난폭운전을 한 버스기사에 대해서는 블랙박스 영상을 토대로 과징금과 과태료 등 행정처분을 내리고 있다. 또 올해부터 상반기 하반기 2번에 걸쳐 버스기사들에게 최대 40만원 상당의 보상금을 지급하는 인센티브 제도를 도입했다""며 ""버스기사들의 처우개선은 올해 노선개편과 배차조정을 통해 운행 여건을 개선했고, 휴식시간도 얼만큼 부여했는지 꾸준히 모니터링 중이다""고 말했다.

이어 ""전주 시민들과 버스기사들에게 보다 효율적이고 편리한 서비스를 제공해 안전한 대중교통 문화 조성을 위해 최선을 다하겠다""고 덧붙였다.

한민호기자

저작권자 © 전민일보 무단전재 및 재배포 금지",2023-12-05 18:18:47
코너링 부드러운데 빨간불엔 급정거... 심야 자율주행버스타보니,,2023-12-05 18:18:47
"경인지역 여야의원, 지역현안 관련 행안부 특교세 대거 확보","경인지역 여야의원들이 지역현안 사업 추진을 위한 행정안전부 특별교부세를 잇따라 대거 확보하는 성과를 거뒀다고 5일 밝혔다.



국민의힘 김성원(동두천·연천)의원은 지역 주민 편의를 위한 특별교부세 총 47억원을 확보했다고 밝혔다.



동두천 종합운동장 인조잔디교체(8억원), 국민체육센터 시설개선(3억원), 불현·소요동 CCTV 확충(8억원), 연천 전곡 도시계획도로 개설(6억원), 옥계-군남 간선관로 개량(12억원), 연천 가축분뇨 및 하수처리시설 진입도로 개설(4억원), 임진강·한탄강 노후 배수문 정비(4억원), 전곡읍 CCTV 신규설치(2억원) 등 총 8개 사업이다.



국민의힘 최춘식(포천·가평)의원은 포천 한내교 보수·보강공사(11억원), 포천 청소년교육문화센터 리모델링(11억원), 가평 초등학교 앞 바닥신호등 설치(3억원), 방범용 CCTV 확대 및 성능개선(9억원), 유기동물보호센터 신축 및 반려인 숲 조성(10억원) 등 총 44억원이 확정됐다.



더불어민주당 정성호(양주)의원은 복지리 도로 개설(5억원)과 범죄예방CCTV 설치 등 4개 사업(9억원)에 총 14억원을 확보했다.



정 의원은 ""앞으로도 지역내 현안사업 해결을 위한 국비지원에 더욱 적극적으로 나서겠다""고 말했다.



민주당 소병훈(광주갑)의원은 반다비 체육센터 건립사업(10억원), 경안·탄벌·광남 등 방범용 CCTV 확충사업(3억원) 등 총 13억원을 확보했다.



민주당 김철민(안산상록을)의원은 부곡동 태마당로 주차환경 개선공사(3억원), 상록수역 버스정류장 보행환경 개선사업(4억원), 동막골 노외주차장 조성사업(7억원) 등 총 14억원을 확보했다.



민주당 임오경(광명갑)의원은 광명동 청년공간(제2청년동) 조성(2억원), 철산동 단독필지 노후 하수관로 정비공사(6억원), 광명전역 주민 생활안전 CCTV설치 사업(3억원) 등 총 11억원을 확보했다.



민주당 윤영찬(성남중원의원은 금광로 33번길 열선 설치(13억원), 대원지하차도 진입차단시설 설치(5억원) 등 총 18억원을 확보했다.



같은 당 신동근(인천 서을)의원은 인천 서구 어린이보호구역 스마트 횡단보도 설치 등 총 19억원을, 맹성규(인천 남동갑)의원은 논현포대근린공원 환경개선과 지역 방범용 CCTV 설치 등 8억원을, 허종식(인천 동·미추홀갑)의원은 만석·화수 해안산책로 복합커뮤니티센터 조성 등 총 25억원이 확정됐다.



김재득기자/",2023-12-05 18:18:48
제목,기사 내용,타임스탬프
“신호등 인식 척척… 잦은 급정거는 불안”,"4일 오후 11시 반경 서울 마포구 합정역 정류장에서 시민들이 세계 첫 심야 자율주행버스 ‘심야 A21번’에 탑승하고 있다. 뉴스1



● “생각보다 안정적” vs “급정거 잦아 불안”

서울 종로구 동대문역까지 운행된 버스는 모든 주행 과정이 자동으로 진행됐으며, 돌발 상황에 대비해 운전사가 동승했지만 개입할 일은 없었다. 뉴스1

● 당분간 무료 운행…내년 상반기 유료화

“자율주행 버스에 탑승하신 걸 환영합니다. 안전벨트를 착용해 주세요.”5일 0시 50분. 서울 마포구 합정역에서 ‘심야 A21번’ 버스에 오르며 교통카드를 태그하자 안내방송이 흘러나왔다. 겉보기에는 일반 시내버스와 달라 보이지 않았지만 내부는 달랐다. 운전석에 운전사가 앉아 있긴 했지만 버스가 정류장에 멈추고 출발할 때뿐 아니라 주행 중에도 핸들에 손을 올리지 않았다. 승객이 타고 내릴 때 모두 버스 안팎에 설치된 카메라로 승객을 인식해 자동으로 문이 열리고 닫혔다.실내 좌석은 일반 시내버스와 같은 형태로 배치돼 있었지만 모든 좌석에 안전벨트가 설치돼 있었다. 버스 내부에는 전광판이 설치돼 속도를 알려줬고, 전방 외부 상황을 볼 수 있는 폐쇄회로(CC)TV 화면도 실시간으로 재생됐다.이날 기자가 탑승한 버스는 서울시가 세계 최초로 도입한 심야 자율주행 버스다. 서울시는 그동안 청계천과 청와대, 여의도, 강남, 상암동 등 5곳에서 자율주행 버스를 운행했지만 심야에 운행하는 건 처음이다.노선번호 ‘심야 A21번’ 버스에는 돌발 상황에 대비해 운전사와 특별안전요원이 동행했지만 70분 동안 운행하는 중 한 번도 주행에 개입하지 않았다. 승객들이 모두 안전벨트를 착용하자 합정역에서 출발한 버스는 신촌과 서대문, 종로3가를 지나 동대문역까지 향했다.승객들은 버스가 알아서 차선을 바꾸고 주변 차량을 피하며 좌회전이나 우회전 등을 하는 모습을 보면서 놀라워했다. 또 신호등 신호를 인식해 멈추거나 주행을 재개하는 것에 대해서도 “영화에서나 보던 모습”이란 반응이 나왔다.자율주행버스를 타기 위해 경기 부천시에서 왔다는 마모 씨(37)는 “어렸을 때 상상만 하던 일이 현실이 됐다. 생각보다 주행이 안정적이고 승차감도 일반 버스와 크게 다르지 않아 신기하다”고 했다.반면 버스가 횡단보도나 버스 정거장 앞에서 6, 7분에 한 번꼴로 급정거하는 걸 두고선 우려의 목소리도 나왔다. 직장인 김지훈 씨(28)는 “자율주행이 안전하다고 하는데 아직 개선할 점도 있는 것 같다”고 했다. 서울시 관계자는 “주변 교통 상황을 토대로 버스가 주행 가능한 상황인지 인공지능(AI)이 판단하는데 판단 속도가 늦어지면서 급정거하는 경우가 있다”고 설명했다.심야 A21번 버스는 평일 매일 오후 11시 반∼다음 날 오전 5시 10분 운행한다. 총 2대의 버스가 합정역∼동대문역 9.8km를 순환하는 방식이다. 일반 시내버스처럼 교통카드를 태그하고 타면 되고 입석은 금지된다. 당분간 무료로 운영하고 내년 상반기(1∼6월) 중 노선 연장과 함께 유료화할 방침이다.서울시 관계자는 “자율주행 버스를 통해 중장기적으로 심야 기사 수급 어려움을 해결할 수 있을 것”이라며 “내년 상반기 중 청량리역까지 노선을 확대하고 버스도 추가로 투입하는 방안을 검토 중”이라고 밝혔다.이채완 기자 chaewani@donga.com",2023-12-05 21:13:03
"인천경제청, 내년 인천경제자유구역 교통 불편 해소에 '1370억원 편성'","광역버스 혼잡도 개선 등 올해보다 69.9% 증가…시의회에 증액 요청

IFEZ 교통대책 TF회의 개최…김진용 청장 ""시민 교통불편 해소에 적극 노력""

김진용 인천경제청장 인사말 모습

컨슈머타임스=안우진 기자 | 내년 인천경제청의 교통 분야 예산이 올해보다 563억원 증액될 것으로 전망돼 시민들이 겪는 교통불편이 크게 해소될 것으로 기대된다.

인천경제청은 지난 4일 송도국제도시 G타워에서 '인천경제자유구역(IFEZ) 교통대책 TF' 제2차 회의'를 개최했다고 밝혔다.

인천경제청에 따르면 시의회에 요청한 내년도 IFEZ 교통분야 특별회계 예산 요구안은 총 1368억원으로 올해(805억원)보다 69.9%가 증가했다.

내년 예산은 신규로 편성하거나 증액한 것으로 △광역버스 및 공항 리무진의 혼잡도 개선 지원 △청라국제도시 신교통(GRT) 운영비 지원 △운서역 지하보도 에스컬레이터 설치 △송도·영종·청라국제도시 스마트횡단보도 설치 등에 사용된다.

회의에서는 또 송도 스마트 버스정류장 확대, 영종 대중교통 확충 등 지난 회의에서 건의된 사항과 함께 IFEZ 내 시민 불편사항과 개선 방안 등 교통 환경 개선에 대해 논의했다.

회의에는 IFEZ 교통대책 테스크 포스(TF) 단장인 김진용 인천경제청장을 비롯 주민대표, 인천대 윤병조 교수, 인하대 김용진 교수 등 교통분야 전문가, 인천시, 도로교통공단 등 유관기관 관계자들이 참석했다.

IFEZ 교통대책 TF는 지난 5월 1차 회의를 시작으로 지난 6월과 9월 교통불편 현장점검을 통해 시민들의 어려운 점을 청취했으며 교통환경 개선을 위해 광역교통 배차 추가 등에 사용될 7억원의 예산을 추가로 확보한 바 있다.

김진용 인천경제청장은 ""그동안 IFEZ가 비약적인 성장으로 글로벌 도시로 성장하고 있지만 인구와 통행량 증가로 인한 교통 불편도 증가하고 있다""며 ""앞으로도 TF회의와 현장 점검 등을 통해 시민들의 교통 불편 해소에 적극 노력하겠다""고 말했다.

저작권자 © 컨슈머타임스(Consumertimes) 무단전재 및 재배포 금지",2023-12-05 21:13:04
